,Problem,correct,category,option_a,option_b,option_c,option_d,option_e
115,three 8 faced dice are thrown together . the probability that all the three show the same number on them is ?,d,probability, 1 / 38 , 1 / 48 , 1 / 56 , 1 / 64 , 1 / 68 
116,"set a contains 4 different positive odd integers and 6 different positive even integers . set b contains two different positive odd integers and 3 different positive even integers . if one integer from set a and one integer from set b are chosen at random , what is the probability that the product of the chosen integers is even ?",d,probability, 3 / 5 , 4 / 5 , 17 / 25 , 21 / 25 , 43 / 50 
117,two mba admissions committees are to be formed randomly from 6 second year mbas with 3 members each . what is the probability w that jane will be on the same committee as albert ?,d,probability, 12 % , 20 % , 33 % , 40 % , 50 % 
118,jane and thomas are among the 8 people from which a committee of 3 people is to be selected . how many different possible committees of 3 people can be selected from these 8 people if at least one of either jane or thomas is to be selected ?,d,probability, 24 , 28 , 32 , 36 , 40 
119,"a box contains 3 red balls and 3 black balls . one by one , every ball is selected at random without replacement . what is the probability that the fourth ball selected is black ?",d,probability, 1 / 4 , 1 / 2 , 1 / 2 , 2 , 2 / 3 
120,what is the probability of getting only 1 head in a single throw of four fair coins ?,c,probability, 1 / 2 , 3 / 8 , 1 / 4 , 1 / 5 , 5 / 8 
121,"if two integers x , y ( x > y ) are selected from - 10 to 4 ( inclusive ) , how many possible cases are there ?",e,probability, 150 , 180 , 190 , 210 , 105 
122,"from a pack of 52 cards , two cards are drawn together at random . what is the probability of one is a spade and one is a heart ?",e,probability, 102 / 102 , 5 / 102 , 1 / 102 , 8 / 102 , 13 / 102 
123,four dice are thrown simultaneously . find the probability that all of them show the same face .,a,probability, 1 / 216 , 1 / 215 , 5 / 300 , 1 / 415 , 1 / 500 
124,"there are 7 red balls and 5 blue balls in a jar . if 3 balls are selected from the jar , what is the probability that 3 balls selected are red balls ?",e,probability, 19 / 44 , 5 / 44 , 3 / 41 , 13 / 44 , 7 / 44 
125,three unbiased coins are tossed . what is the probability of getting all tails ?,e,probability, 7 / 8 , 1 / 2 , 3 / 8 , 1 / 4 , 1 / 8 
126,what is the probability of getting 53 mondays in a leap year ?,b,probability, 1 / 7 , 2 / 7 , 3 / 7 , 4 / 7 , 5 / 7 
127,in how many ways 5 boys and 5 girls can be seated in a row so that boys and girls are alternate ?,e,probability, 28400 , 28500 , 28600 , 28700 , 28800 
128,"bill and jane play a simple game involving two fair dice , each of which has 6 sides numbered from 1 to 6 ( with an equal chance of landing on any side ) . bill rolls the dice and his score is the total of the two dice . jane then rolls the dice and her score is the total of her two dice . if jane ’ s score is higher than bill ’ s , she wins the game . what is the probability the jane will win the game ?",c,probability, 15 / 36 , 175 / 432 , 575 / 1296 , 583 / 1296 , 1 / 2 
129,"a string of 50 light bulbs is wired in such a way that if any individual light bulb fails , the entire string fails . if for each individual light bulb the probability of failing during time period t is 0.05 , what is the probability that the string of light bulbs will fail during the time period t ?",d,probability, 0.05 , ( 0.05 ) ^ 50 , 1 - ( 0.96 ) ^ 50 , 1 - ( 0.95 ) ^ 50 , ( 0.95 ) ^ 50 
130,"a bag contains 3 blue and 5 white marbles . one by one , marbles are drawn out randomly until only two are left in the bag . what is the probability q that out of the two , one is white and one is blue ?",d,probability, 15 / 56 , 41 / 56 , 13 / 28 , 15 / 28 , 5 / 14 
131,6 animals of a circus has to be placed inside in 6 cages one in each cage . if 4 of the cage are too small for 6 of the animal then find the number of ways of caging the animal .,a,probability, a . 240 , b . 808250 , c . 502450 , d . 784200 , e . 302400 
132,if you throw two dice at a same time . can you find the probability of getting sum as 10 of the two numbers shown ?,c,probability, 1 / 16 , 2 / 14 , 1 / 12 , 1 / 19 , 1 / 17 
133,"how many positive integers less than 300 can be formed using the numbers 1 , 2 , 3 a for the digits ?",a,probability, 30 , 52 , 66 , 68 , 84 
134,"there is a 20 % chance sandy will visit china this year , while there is a 60 % chance that she will visit malaysia this year . what is the probability that sandy will visit either china or malaysia this year , but not both ?",c,probability, 40 % , 48 % , 56 % , 64 % , 72 % 
135,"a box contains 20 electric bulbs , out of which 4 are defective . two bulbs are chosen at random from this box . the probability that at least one of these is defective is",a,probability, 7 / 19 , 6 / 19 , 5 / 19 , 4 / 19 , none of these 
136,in a lottery there are 10 prizes and 25 blanks . a lottery is drawn at random . what is the probability of getting a blank ?,c,probability, 2 / 3 , 6 / 7 , 5 / 7 , 8 / 7 , 4 / 3 
137,two letters from the word khantkar are selected at random . what is the probability that at least one of the selected letters is a consonant ?,b,probability, 25 / 28 , 27 / 28 , 30 / 28 , 40 / 28 , 50 / 28 
138,persons a and b . person a picks a random no . from 1 to 1000 . then person b picks a random no . from 1 to 1000 . what is the probability of b getting no . greater then what a has picked .,b,probability, 0.3995 , 0.4995 , 0.5995 , 0.6995 , 0.7995 
139,"a certain club has 10 members , including jarry . one of the 10 members is chosen at random to be the president , one of the remaining 9 members is to be chosen at random to be the secretary , and one of the remaining 8 members is to be chosen at random to be the treasurer . what is the probability that jarry will be either the member chose to be secretary or the member chose to be treasurer ?",e,probability, 1 / 720 , 1 / 80 , 1 / 10 , 1 / 9 , 1 / 5 
140,two dice are thrown simultaneously . what is the probability of getting two numbers whose product is not an even ?,b,probability, 1 / 2 , 1 / 4 , 2 / 3 , 2 / 5 , 3 / 7 
141,"if 4 consecutive letters are selected at random from the english alphabet , then the probability that one of the letters is a vowel is ?",d,probability, 13 / 23 , 16 / 23 , 11 / 23 , 17 / 23 , 18 / 23 
142,there are 7 girls and 3 chairs . in how many ways girls can occupy the chairs ?,b,probability, 760 , 210 , 560 , 740 , 800 
143,"on a windy day , out of every 3 sand dunes formed , only 1 remains . out of 5 blown - out sand - dunes , 1 has treasure and only 2 out of 3 sand dunes formed have lucky coupons . find the probability that the blown - out sand dune will contain both the things .",e,probability, 2 / 25 , 4 / 75 , 7 / 75 , 3 / 5 , 4 / 45 
144,"in a certain animal population , for each of the first 3 months of life , the probability that an animal will die during that month is 1 / 10 . for a group of 700 newborn members of the population , approximately how many would be expected to survive the first 3 months of life ?",a,probability, 511 , 546 , 552 , 562 , 570 
145,"in a single throw of a die , what is probability of getting a number greater than 4 ?",e,probability, 2 / 3 , 3 / 5 , 4 / 7 , 8 / 9 , 1 / 3 
146,"a bag contains 10 red jellybeans and 10 blue jellybeans . if 3 jellybeans are removed one at a time , at random and are not replaced , what is the probability y that all 3 jellybeans removed from the bag are blue ?",b,probability, 9 / 100 , 2 / 19 , 1 / 8 , 3 / 20 , 3 / 10 
147,the chance of rain on any given day in tel - aviv is 50 % . what is the probability a that it rained in tel - aviv on exactly 4 out of 6 randomly chosen days ?,a,probability, 15 / 64 , 30 / 64 , 1 / 2 , 1 / 4 , 52 / 64 
148,"how many different ways can 2 students be seated in a row of 7 desks , so that there is always at least one empty desk between the students ?",c,probability, 2 , 3 , 30 , 6 , 12 
149,in 15 year ’ s time the combined age of my 4 brothers will be 107 . what will it be in the 6 year ’ s time ?,c,probability, 61 , 78 , 71 , 68 , 94 
150,"what is the probability that the sum of two dice will yield a 8 , and then when both are thrown again , their sum will again yield a 8 ? assume that each die has 7 sides with faces numbered 1 to 7 .",e,probability, 1 / 144 , 1 / 36 , 1 / 12 , 1 / 6 , 1 / 49 
151,"in a certain animal population , for each of the first 3 months of life , the probability that an animal will die during that month is 1 / 10 . for a group of 250 newborn members of the population , approximately how many would be expected to survive the first 3 months of life ?",e,probability, 140 , 146 , 152 , 162 , 183 
152,in how many ways can 11 books on english and 9 books on french be placed in a row on a shelf so that two books on french may not be together ?,a,probability, 220 . , 240 , 260 , 280 , 300 
153,three coins are tossed . find the probability of at least 1 head and 1 tail ?,c,probability, 1 / 2 , 1 / 4 , 3 / 4 , 7 / 8 , 1 / 8 
154,two mba admissions committees are to be formed randomly from 6 second year mbas with 3 members each . what is the probability r that jane will be on the same committee as albert ?,d,probability, 12 % , 20 % , 33 % , 40 % , 50 % 
155,"if a certain coin is flipped , the probability that the coin will land heads is 1 / 2 . if the coin is flipped 5 times , what is the probability that it will land heads up on the first 2 flips but not on the last 3 flips ?",e,probability, 1 / 2 , 1 / 4 , 1 / 8 , 1 / 16 , 1 / 32 
156,there are 7 red shoes & 3 green shoes . if two of red shoes are drawn what is the probability of getting red shoes,d,probability, 1 / 13 , 1 / 14 , 1 / 15 , 7 / 15 , 7 / 16 
157,"the maitre ' d at an expensive manhattan restaurant has noticed that 60 % of the couples order dessert and coffee . however , 20 % of the couples who order dessert do n ' t order coffee . what is the probability q that the next couple the maitre ' d seats will not order dessert ?",b,probability, 20 % , 25 % , 40 % , 60 % , 75 % 
158,"in a certain animal population , for each of the first 3 months of life , the probability that an animal will die during that month is 1 / 10 . for a group of 300 newborn members of the population , approximately how many would be expected to survive the first 3 months of life ?",a,probability, 219 , 246 , 252 , 262 , 270 
159,"a box contains 1 red balls and 5 black balls . one by one , every ball is selected at random without replacement . what is the probability that the fourth ball selected is black ?",c,probability, 1 / 4 , 1 / 2 , 1 / 2 , 5 / 8 , 2 / 3 
160,"if x is to be chosen at random from the set { 1 , 2 , 3 , 4 } and y is to be chosen at random from the set { 5 , 6 , 7 } , what is the probability that xy will be odd ?",b,probability, 1 / 6 , 1 / 3 , 1 / 2 , 2 / 3 , 5 / 6 
161,"a box contains 2 red balls and 5 black balls . one by one , every ball is selected at random without replacement . what is the probability that the fourth ball selected is black ?",b,probability, 1 / 4 , 7 / 5 , 1 / 2 , 5 / 8 , 2 / 3 
162,there are 8 pairs of socks and 2 socks are worn from that such that the pair of socks worn are not of the same pair . what is the number of pair that can be formed .,d,probability, 53 , 54 , 55 , 56 , 57 
163,"a certain junior class has 1000 students and a certain senior class has 600 students . among these students , there are 60 siblings pairs each consisting of 1 junior and 1 senior . if 1 student is to be selected at random from each class , what is the probability that the 2 students selected will be a sibling pair ?",b,probability, 3 / 40000 , 1 / 1000 , 9 / 2000 , 1 / 60 , 1 / 15 
164,there are 24 students in a class . in how many different ways can a committee of 3 students be formed ?,c,probability, 1250 , 1800 , 2024 , 3256 , 2864 
165,three coins are tossed . find the probability of at least 2 tails ?,a,probability, 1 / 2 , 2 / 3 , 1 / 4 , 1 / 8 , 3 / 8 
166,"from a pack of 52 cards , 1 card is drawn at random . what is the probability that a red card is drawn ?",a,probability, 1 / 2 , 1 / 4 , 1 / 26 , 1 / 13 , 5 / 13 
167,a letter lock consists of 3 rings each marked with 6 different letters . the number of distinct unsuccessful attempts to open the lock is at the most - .,c,probability, 216 , 243 , 215 , 729 , 728 
168,"a meeting has to be conducted with 5 managers . find the number of ways in which the managers may be selected from among 7 managers , if there are 2 managers who refuse to attend the meeting together .",d,probability, 6 , 8 , 10 , 11 , 15 
169,"a box contains 100 balls , numbered from 1 to 100 . if 3 balls are selected at random and with replacement from the box . if the 3 numbers on the balls selected contain two odd and one even . what is the probability g that the first ball picked up is odd numbered ?",d,probability, 0 , 1 / 3 , 1 / 2 , 2 / 3 , 1 
170,"if 4 people are selected from a group of 10 married couples , what is the probability that none of them would be married to each other ?",d,probability, 1 / 33 , 2 / 63 , 1 / 3 , 43 / 62 , 11 / 12 
171,find the probability that a year chosen at random has 53 mondays .,a,probability, 5 / 28 , 3 / 28 , 1 / 28 , 3 / 28 , 3 / 27 
172,"a certain junior class has 1000 students and a certain senior class has 800 students . among these students , there are 40 siblings pairs each consisting of 1 junior and 1 senior . if 1 student is to be selected at random from each class , what is the probability that the 2 students selected will be a sibling pair ?",c,probability, 3 / 40000 , 1 / 3600 , 1 / 20000 , 1 / 60 , 1 / 15 
173,a card is drawn from a pack of 52 cards . the probability of getting a queen of club or a king of heart is,c,probability, 1 / 13 , 2 / 13 , 1 / 26 , 1 / 52 , 1 / 23 
174,the probability that a number selected at random from the first 50 natural numbers is a composite number is ?,b,probability, 17 / 65 , 17 / 25 , 17 / 28 , 17 / 65 , 17 / 39 
175,in a lottery there are 10 prizes and 25 blanks . a lottery is drawn at random . what is the probability of getting a prize ?,b,probability, 1 / 5 , 2 / 7 , 2 / 5 , 1 / 7 , 3 / 5 
176,"45 girls and 60 boys are present at a party . there are 17 girl - boy are in relationship among them . if a girl and a boy is selected at random , what is the probability that they will be not a couple ?",b,probability, 17 / 2900 , 2683 / 2700 , 2496 / 2700 , 2369 / 2700 , 198 / 270 
177,"a store has 10 bottles of juice , including 6 bottles of apple juice . in the evening , 6 bottles of juice are sold one by one . what is the probability of selling 2 bottles of apple juice among the 6 bottles ? assume that every bottle has an equal chance of being bought .",c,probability, 1 / 7 , 1 / 12 , 1 / 14 , 1 / 18 , 1 / 21 
178,"a meeting has to be conducted with 5 managers . find the number of ways in which the managers may be selected from among 8 managers , if 2 managers will not attend the meeting together .",d,probability, 1.35 , 2.91 , 3.12 , 4.36 , 5.15 
179,"find the probability that a number selected from numbers 1 , 2 , 3 , . . . , 45 is a prime number , when each of the given numbers is equally likely to be selected ?",b,probability, 10 / 45 , 14 / 45 , 8 / 45 , 3 / 45 , 7 / 45 
180,two coins are tossed . find the probability of at most 2 tails ?,d,probability, 1 / 2 , 1 / 4 , 1 / 3 , 1 , 3 / 4 
181,"when two dice are rolled , what is the probability that the sum is either 7 or 11 ?",e,probability, 1 / 4 , 1 / 9 , 4 / 3 , 3 / 9 , 2 / 9 
182,two mba admissions committees are to be formed randomly from 6 second year mbas with 3 members each . what is the probability q that jane will be on the same committee as albert ?,d,probability, 12 % , 20 % , 33 % , 40 % , 50 % 
183,"if g is to be chosen at random from the set { 5,8 , 7,1 } and k is to be chosen at random from the set { 14 , 8,3 } , what is the probability that gk will be even ?",a,probability, 1 , 5 , 8 , 4 , 3 
184,"in a certain animal population , for each of the first 3 months of life , the probability that an animal will die during that month is 1 / 10 . for a group of 500 newborn members of the population , approximately how many would be expected to survive the first 3 months of life ?",d,probability, 340 , 346 , 352 , 365 , 370 
185,"kim has 5 pairs of shoes ; each pair is a different color . if kim randomly selects 2 shoes without replacement from the 10 shoes , what is the probability that she will select 2 shoes of the same color ?",c,probability, 2 / 5 , 1 / 5 , 1 / 9 , 1 / 10 , 1 / 25 
186,find the probability that a leap year selected at random will have 53 mondays,e,probability, 6 / 7 , 5 / 7 , 4 / 7 , 3 / 7 , 2 / 7 
187,"a box contains 100 balls , numbered from 1 to 100 . if 3 balls are selected at random and with replacement from the box . if the 3 numbers on the balls selected contain two odd and one even . what is the probability l that the first ball picked up is odd numbered ?",d,probability, 0 , 1 / 3 , 1 / 2 , 2 / 3 , 1 
188,two mba admissions committees are to be formed randomly from 6 second year mbas with 3 members each . what is the probability e that jane will be on the same committee as albert ?,d,probability, 12 % , 20 % , 33 % , 40 % , 50 % 
189,"there is a 50 % chance jen will visit chile this year , while there is a 50 % chance that she will visit madagascar this year . what is the probability that jen will visit either chile or madagascar this year , but not both ?",b,probability, 25.0 % , 50.0 % , 62.5 % , 75.0 % , 80.0 % 
190,in how many ways can 21 books on english and 19 books on french be placed in a row on a shelf so that two books on french may not be together ?,b,probability, 3990 , 1540 , 1995 , 3672 , none of these 
191,"john borrowed 3 soccer boots from jake , and forgot them on the field , if peter came across a total of 15 boots on the field jake ' s boots inclusive , and he took 4 boots at random , what is the probability that jake ' s boots were not amongst the 4 taken ? .",d,probability, 12 / 91 , 3 / 15 , 12 / 15 , 33 / 91 , 3 / 91 
192,"wink , inc . follows a certain procedure that requires two tasks to be finished independently in order for a job to be done . on any given day , there is a 1 / 8 probability that task 1 will be completed on time , and a 3 / 5 probability that task 2 will be completed on time . on a certain day , what is the probability that task 1 will be completed on time , but task 2 will not ?",a,probability, 1 / 20 , 3 / 40 , 13 / 40 , 7 / 20 , 13 / 22 
193,find the probability that a non leap year selected at random will have 53 sundays,e,probability, 6 / 7 , 5 / 7 , 4 / 7 , 3 / 7 , 1 / 7 
194,a circular dartboard of radius 1 foot is at a distance of 20 feet from you . you throw a dart at it and it hits the dartboard at some point q in the circle . what is the probability that q is closer to the center of the circle than the periphery ?,c,probability, 0.75 , 1 , 0.25 , 0.5 , 0.58 
195,8 coins are tossed . whats is the probability that one and only one turns up head ?,b,probability, 1 / 256 , 1 / 32 , 1 / 64 , 1 / 128 , 1 / 189 
196,"in lottery , there are 10 prizes and 25 blanks . a lottery is drawn at random . what is the probability of getting a prize ?",b,probability, 1 / 7 , 2 / 7 , 3 / 7 , 4 / 7 , 1 
197,"a bag contains 6 red , 3 yellow and 4 green balls . 3 balls are drawn randomly . what is the probability that the balls drawn contain balls of different colours ?",d,probability, 2 / 7 , 3 / 5 , 3 / 11 , 1 / 4 , 7 / 16 
198,"there are 6 red balls and 4 blue balls in a jar . if 3 balls are selected from the jar , what is the probability that all 3 balls selected are blue balls ?",c,probability, 1 / 18 , 1 / 24 , 1 / 30 , 1 / 36 , 1 / 48 
199,the probability that a number selected at random from the first 50 natural numbers is a composite number is - .,a,probability, 17 / 25 , 17 / 27 , 17 / 18 , 17 / 22 , 17 / 09 
200,"there are 10 books on a shelf , of which 4 are paperbacks and 6 are hardbacks . how many possible selections of 5 books from the shelf contain at least one paperback and at least one hardback ?",d,probability, 75 , 120 , 210 , 246 , 252 
201,"what is the probability that the sum of two dice will yield a 4 , and then when both are thrown again , their sum will again yield a 4 ? assume that each die has 3 sides with faces numbered 1 to 3 .",c,probability, 1 / 144 , 1 / 36 , 1 / 9 , 1 / 6 , 1 / 3 
202,"a box contains 100 balls , numbered from 1 to 100 . if 3 balls are selected at random and with replacement from the box . if the 3 numbers on the balls selected contain two odd and one even . what is the probability z that the first ball picked up is odd numbered ?",d,probability, 0 , 1 / 3 , 1 / 2 , 2 / 3 , 1 
203,"if 4 people are selected from a group of 9 married couples , what is the probability that none of them would be married to each other ?",d,probability, 1 / 33 , 2 / 85 , 1 / 3 , 56 / 85 , 11 / 85 
204,two unbiased coins are tossed . what is probability of getting at most one tail ?,d,probability, 12 , 13 , 32 , 34 , none of these 
205,"from a group of 3 boys and 3 girls , 2 children are to be randomly selected . what is the probability that 1 boy and 1 girl will be selected ?",d,probability, 1 / 10 , 4 / 9 , 1 / 2 , 9 / 15 , 2 / 3 
206,"preethi has 6 flavors of ice cream in his parlor . how many options are there for dorathy to pick a one - flavor , two - flavor , 3 - flavor , 4 - flavor , 5 flavor or 6 flavor order ?",e,probability, 26 , 36 , 64 , 67 , 63 
207,the probability that a number selected at random from the first 100 natural numbers is a composite number is ?,d,probability, 2 / 3 , 3 / 5 , 3 / 4 , 3 / 2 , 5 / 2 
208,"tomeka is playing a dice game . if she rolls the same number on her second roll as she rolls on her first , she wins . each roll is with two , fair , 6 - sided dice . if tomeka rolled a 7 on her first roll , what is the probability that she will win on her second roll ?",c,probability, 1 / 4 , 1 / 5 , 1 / 6 , 1 / 9 , 1 / 12 
209,"john and peter are among the 9 players a volleyball coach can choose from to field a 6 - player team . if all 6 players are chosen at random , what is the probability of choosing a team that includes john and peter ?",c,probability, 3 / 10 , 4 / 11 , 5 / 12 , 6 / 13 , 7 / 15 
210,in how many ways 4 boys and 3 girls can be seated in a row so that they are alternate .,a,probability, 144 , 288 , 12 , 256 , none 
211,"a store has 10 bottles of juice , including 5 bottles of apple juice . in the evening , 6 bottles of juice are sold one by one . what is the probability of selling 4 bottles of apple juice among the 6 bottles ? assume that every bottle has an equal chance of being bought .",d,probability, 2 / 7 , 3 / 11 , 4 / 15 , 5 / 21 , 6 / 25 
212,two unbiased coins are tossed . find the probability of getting at most one head ?,b,probability, 1 / 2 , 3 / 4 , 2 / 5 , 2 / 3 , 1 / 4 
213,a fair coin is tossed 13 times . what is the probability of getting more heads than tails in 13 tosses ?,a,probability, 1 / 2 , 63 / 128 , 4 / 7 , 61 / 256 , 63 / 64 
214,"into a bag there are 20 honey and 5 cherry candies . if a boy pick only two candies simultaneous and randomly , what is the probability that he picks one candy of each flavor ?",e,probability, 2 / 25 , 1 / 50 , 1 / 12 , 1 / 6 , 1 / 3 
215,"in a garden , there are yellow and green flowers which are straight and curved . if the probability of picking a green flower is 3 / 4 and picking a straight flower is 1 / 2 , then what is the probability of picking a flower which is yellow and curved",a,probability, 1 / 8 , 1 / 6 , 1 / 4 , 3 / 4 , 7 / 8 
216,jane and thomas are among the 7 people from which a committee of 3 people is to be selected . how many different possible committees of 3 people can be selected from these 7 people if at least one of either jane or thomas is to be selected ?,b,probability, 20 , 25 , 30 , 35 , 40 
217,"a player holds 13 cards of 4 suits , of which 7 are black and 6 are red . there are twice as many diamonds as spades and twice as many hearts as diamonds . how many clubs does he hold",c,probability, 4 , 5 , 6 , 7 , 8 
218,"if 4 people are selected from a group of 5 married couples , what is the probability that none of them would be married to each other ?",e,probability, 1 / 33 , 2 / 33 , 1 / 3 , 16 / 33 , 8 / 21 
219,3.00001 unbiased coins are tossed . what is the probability of getting 2 tails ?,c,probability, 3 / 4 , 1 / 4 , 3 / 8 , 7 / 8 , 1 / 8 
220,"when tossed , a certain coin has equal probability of landing on either side . if the coin is tossed 4 times , what is the probability that it will land on the same side each time ?",a,probability, 1 / 8 , 1 / 4 , 1 / 16 , 1 / 2 , 1 / 32 
221,"a bag consists of 50 marbles , of which 5 are blue , 9 are red , and the remainder are white . if lisa is to select a marble from the bag at random , what is the probability that the marble will be red or white ?",e,probability, 3 / 4 , 2 / 4 , 1 / 4 , 1 / 8 , 9 / 10 
222,"a box contains 23 electric bulbs , out of which 4 are defective . two bulbs are chosen at random from this box . the probability that at least one of these is defective is",c,probability, 4 / 19 , 7 / 19 , 12 / 37 , 21 / 95 , none 
223,"what is the probability that a number selected from number 1 to 30 is prime number , when each of the given numbers is equally likely to be selected ?",a,probability, 10 / 30 , 20 / 30 , 1 , 5 / 30 , 15 / 30 
224,there are 8 students . 4 of them are men and 4 of them are women . if 4 students are selected from the 8 students . what is the probability that the number of men is equal to that of women ?,a,probability, 18 / 35 , 16 / 35 , 14 / 35 , 13 / 35 , 12 / 35 
225,find the probability that a leap year selected at random will not have 53 sundays,b,probability, 6 / 7 , 5 / 7 , 4 / 7 , 3 / 7 , 2 / 7 
