,Problem,correct,category,option_a,option_b,option_c,option_d,option_e
955,"a football field is 10800 square yards . if 1200 pounds of fertilizer are spread evenly across the entire field , how many pounds of fertilizer were spread over an area of the field totaling 3600 square yards ?",a,geometry, 400 , 600 , 750 , 2400 , 3200 
956,the area of a rectangle is 15 square centimeters and the perimeter is 16 square centimeters . what are the dimensions of the rectangle ?,a,geometry, 3 and 5', 3 and 6', 3 and 7', 3 and 8', 3 and 9'] 
957,"a tailor trims 11 feet from opposite edges of a square piece of cloth , and 7 feet from the other two edges . if 84 square feet of cloth remain , what was the length of a side of the original piece of cloth ?",c,geometry, 26 , 27 , 28 , 29 , 30 
958,two cubes have their volumes in the ratio 1 : 27 . find the ratio of their surface areas .,a,geometry, 1 : 9', 2 : 9', 3 : 9', 5 : 9', none of them'] 
959,how many odd numbers between 10 and 2000 are the squares of integers ?,e,geometry, 12 , 14 , 16 , 18 , 20 
960,"in may , the groundskeeper at spring lake golf club built a circular green with an area of 80 π square feet . in august , the groundskeeper doubled the distance from the center of the green to the edge of the green . what is the total area of the renovated green ?",b,geometry, 160 π , 320 π , 400 π , 540 π , 640 π 
961,"80 pie square inches of material of negligible thickness are required to construct a 1 / 16 scale model of a cylindrical barrel . if the diameter of the base of the barrel is 160 inches , then what is the volume of the barrel , to the nearest cubic foot ?",c,geometry, 2 pie', 11 pie', 178 pie', 711 pie', 1280 pie'] 
962,"what is the perimeter , in meters , of a rectangular garden 24 meters wide that has the same area as a rectangular playground 16 meters long and 12 meters wide ?",c,geometry, 48 , 56 , 64 , 76 , 192 
963,"a metallic sheet is of rectangular shape with dimensions 48 m x 36 m . from each of its corner , a square is cut off so as to make an open box . if the length of the square is 8 m , the volume of the box ( in m 3 ) is",c,geometry, 6420 , 8960 , 5120 , 4830 , none 
964,the perimeter of a triangle is 36 cm and the in radius of the triangle is 2.5 cm . what is the area of the triangle ?,e,geometry, 76 , 88 , 66 , 55 , 45 
965,"the length of rectangle is thrice its breadth and its perimeter is 88 m , find the area of the rectangle ?",b,geometry, 432 sq m', 363 sq m', 452 sq m', 428 sq m', 525 sq m'] 
966,the ratio of the volumes of two cubes is 729 : 2197 . what is the ratio of their total surface areas ?,a,geometry, 81 : 169 , 81 : 122 , 81 : 124 , 81 : 126 , 81 : 129 
967,"two circular signs are to be painted . if the diameter of the larger sign is 7 times that of the smaller sign , how many times more paint is needed to paint the larger sign ? ( we can assume that a given amount of paint covers the same area on both signs . )",d,geometry, 7 , 14 , 42 , 49 , 98 
968,the diagonals of a rhombus are 30 cm and 20 cm . find its area ?,e,geometry, 176 , 190 , 150 , 278 , 300 
969,"in a rectangular coordinate system , what is the area of a rhombus whose vertices have the coordinates ( 0 , 7.5 ) , ( 8 , 0 ) , ( 0 , - 7.5 ) , ( - 8 , 0 ) ?",e,geometry, 56 , 88 , 112 , 116 , 120 
970,find the area of a parallelogram with base 36 cm and height 24 cm ?,d,geometry, 760 , 284 , 288 , 864 , 820 
971,the size of a flat - screen television is given as the length of the screen ’ s diagonal . how many square inches greater is the screen of a square 28 - inch flat - screen television than a square 25 - inch flat - screen television ?,a,geometry, 79.5', 89.3', 85.5', 75.4', 72.5'] 
972,"a rectangular grass field is 75 m * 55 m , it has a path of 2.5 m wide all round it on the outside . find the area of the path and the cost of constructing it at rs . 2 per sq m ?",b,geometry, 2999 , 1350 , 2677 , 2898 , 2787 
973,the hypotenuse of a right triangle is 2 centimeters more than the longer side of the triangle . the shorter side of the triangle is 7 centimeters less than the longer side . find the length of the hypotenuse .,a,geometry, 17 , 18 , 19 , 20 , 21 
974,"a rectangular field is to be fenced on three sides leaving a side of 30 feet uncovered . if the area of the field is 600 sq . ft , how many feet of fencing will be required ?",a,geometry, 70 feet , 52 feet , 32 feet , 12 feet , 55 feet 
975,the radius of a cylindrical vessel is 7 cm and height is 5 cm . find the whole surface of the cylinder ?,b,geometry, 281 , 528 , 440 , 767 , 1981 
976,"if the volume of a cube is x ^ 3 cubic units , what is the number of square units in the surface area of the cube ?",d,geometry, x ^ 2', x ^ 3', x ^ 6', 6 x ^ 2', 6 x ^ 3'] 
977,the area of a square field is 28808 sq m . how long will a lady take to cross the field diagonally at the rate of 7.2 km / hr ?,c,geometry, 2.5 min , 3 min , 2 min , 4 min , 4.5 min 
978,the monthly rent of a shop of dimension 10 feet × 10 feet is rs . 1300 . what is the annual rent per square foot of the shop ?,b,geometry, 43 , 156 , 68 , 87 , 92 
979,the ratio of the volumes of a cube to that of the sphere which will fit inside the cube is ?,d,geometry, 6.862 kg', 6.838 kg', 6.632 kg', 6.832 kg', 6.834 kg'] 
980,the ratio of the volumes of two cubes is 1000 : 3375 . what is the ratio of their total surface areas ?,b,geometry, 81 : 121 , 4 : 9 , 729 : 1331 , 27 : 121 , none of these 
981,a box is in the shape of a semicircle with a radius of 12 . what is the approximate perimeter of the semicircle ?,b,geometry, 54', 62', 25', 34', 60'] 
982,"if y is the smallest positive integer such that 3,675 multiplied by y is the square of an integer , then y must be",e,geometry, 2 , 5 , 6 , 7 , 12 
983,a box measuring 72 inches long by 48 inches wide by 24 inches deep is to be filled entirely with identical cubes . no space is to be left unfilled . what is the smallest number of cubes that can accomplish this objective ?,e,geometry, 17 , 18 , 54 , 108 , 162 
984,find the area of a parallelogram with base 12 cm and height 8 cm ?,a,geometry, 96 cm 2 , 104 cm 2 , 78 cm 2 , 86 cm 2 , 76 cm 2 
985,the diagonals of a rhombus are 13 cm and 20 cm . find its area ?,b,geometry, 176 , 130 , 150 , 179 , 172 
986,"a rectangular lawn 70 m × 30 m has two roads each 5 metres wide , running in the middle of it , one parallel to the length and the other parallel to the breadth . find the cost of gravelling the road at the rate of 4 per square metre .",c,geometry, 2, 1, 1, 1, none of these'] 
987,in how many r ways can 5 people from a group of 6 people be seated around a circular table,e,geometry, 56', 80', 100', 120', 144'] 
988,consider a quarter of a circle of radius 20 . let r be the radius of the circle inscribed in this quarter of a circle . find r .,a,geometry, 20 * ( sqr 2 - 1 )', 8 * ( sqr 3 - 1 )', 4 * ( sqr 7 - 1 )', 12 * ( sqr 7 - 1 )', none of these'] 
989,a horse is tethered to one corner of a rectangular grassy field 40 m by 24 m with a rope 14 m long . over how much area of the field can it graze ?,a,geometry, 154 cm 2', 308 m 2', 150 m 2', 407 m 2', none of these'] 
990,a circular garden is surrounded by a fence of negligible width along the boundary . if the length of the fence is 1 / 8 of th area of the garden . what is the radius of the circular garden ?,e,geometry, 1', 2', 4', 8', 16'] 
991,a circular logo is enlarged to fit the lid of a jar . the new diameter is 20 per cent larger than the original . by what percentage has the area of the logo increased ?,d,geometry, 50 , 80 , 100 , 44 , 250 
992,what is the perimeter of a square field whose diagonal is 8 √ 2 ?,b,geometry, 82 m , 32 m , 27 m , 26 m , 76 m 
993,"the volume of a certain substance is always directly proportional to its weight . if 48 cubic inches of the substance weigh 112 ounces , what is the volume , in cubic inches , of 53 ounces of this substance ?",d,geometry, 27 , 36 , 42 , 22 , 147 
994,a circular logo is enlarged to fit the lid of a jar . the new diameter is 40 per cent larger than the original . by what percentage has the area of the logo increased ?,b,geometry, 50 , 96 , 100 , 125 , 250 
995,"the volume of a sphere with radius r is ( 4 / 3 ) * pi * r ^ 3 and the surface area is 4 * pi * r ^ 3 . if a sperical balloon has a volume of 4500 pi cubic centimeters , what is hte surface area of the balloon in square centimeters ?",e,geometry, a . 40 , b . 100 , c . 400 , d . 1, e . 2
996,the parameter of a square is equal to the perimeter of a rectangle of length 18 cm and breadth 14 cm . find the circumference of a semicircle whose diameter is equal to the side of the square . ( round off your answer to two decimal places ),b,geometry, 77.14 cm , 25.14 cm , 84.92 cm , 94.94 cm , 23.57 cm 
997,"the area of the floor of a room is 20 m 2 that of a longer wall 15 m 2 and of the shorter wall 12 m 2 , find the edge of the new cube ?",c,geometry, 450 m 3', 100 m 2', 60 m 3', 400 m 3', 500 m 3'] 
998,the size of a flat - screen television is given as the length of the screen ’ s diagonal . how many square inches greater is the screen of a square 34 - inch flat - screen television than a square 27 - inch flat - screen television ?,c,geometry, 106.75 , 213.5 , 427 , 729 , 1
999,"what positive number , when squared , is equal to the cube of the positive square root of 15 ?",d,geometry, 64 , 32 , 8 , 6 , 2 
1000,find the area of a parallelogram with base 22 cm and height 21 cm ?,a,geometry, 462 cm 2 , 478 cm 2 , 490 cm 2 , 268 cm 2 , 668 cm 2 
1001,"the width of a rectangular hall is ½ of its length . if the area of the hall is 288 sq . m , what is the difference between its length and breadth ?",c,geometry, 8 m , 10 m , 12 m , 15 m , 17 m 
1002,a steel vessel has a base of length 60 cm and breadth 30 cm . water is poured in the vessel . a cubical steel box having edge of 30 cm is immersed completely in the vessel . how much will the water rise ?,c,geometry, 7.5 cm rise', 10 cm rise', 15 cm rise', 30 cm rise', none of these'] 
1003,"if the sides of a triangle are 30 cm , 28 cm and 14 cm , what is its area ?",a,geometry, 196 cm 2 , 187 cm 2 , 178 cm 2 , 189 cm 2 , 176 cm 2 
1004,the parameter of a square is equal to the perimeter of a rectangle of length 4 cm and breadth 2 cm . find the circumference of a semicircle whose diameter is equal to the side of the square . ( round off your answer to two decimal places ) ?,b,geometry, 4.51 , 4.71 , 4.32 , 4.21 , 4.68 
1005,"a specialized type of sand consists of 40 % mineral x by volume and 60 % mineral y by volume . if mineral x weighs 1.5 grams per cubic centimeter and mineral y weighs 3 grams per cubic centimeter , how many grams does a cubic meter of specialized sand combination weigh ? ( 1 meter = 100 centimeters )",a,geometry, 2 , 2 , 55, 28, 280 
1006,"if a square mirror has a 20 - inch diagonal , what is the approximate perimeter r of the mirror , in inches ?",b,geometry, 40 , 60 , 80 , 100 , 120 
1007,"if the sides of a triangle are 28 cm , 26 cm and 10 cm , what is its area ?",d,geometry, 120 cm 2 , 112 cm 2 , 776 cm 2 , 130 cm 2 , 886 cm 2 
1008,what is the area of an equilateral triangle whose one side length is 40 ?,e,geometry, 100 √ 3 , 200 √ 3 , 300 √ 3 , 350 √ 3 , 400 √ 3 
1009,the area of a parallelogram is 242 sq m and its altitude is twice the corresponding base . then the length of the base is ?,d,geometry, 8 , 9 , 7 , 11 , 2 
1010,"the volume of a sphere with radius r is ( 4 / 3 ) * pi * r ^ 3 and the surface area is 4 * pi * r ^ 3 . if a sperical balloon has a volume of 2304 pi cubic centimeters , what is hte surface area of the balloon in square centimeters ?",d,geometry, a . 40', b . 100', c . 400', d . 1, e . 10
1011,how many odd numbers between 10 and 1200 are the squares of integers ?,d,geometry, 12 , 13 , 14 , 15 , 16 
1012,"rectangular tile each of size 25 cm by 65 cm must be laid horizontally on a rectangular floor of size 150 cm by 390 cm , such that the tiles do not overlap and they are placed with edges jutting against each other on all edges . a tile can be placed in any orientation so long as its edges are parallel to the edges of floor . no tile should overshoot any edge of the floor . the maximum number of tiles that can be accommodated on the floor is :",d,geometry, 50 , 40 , 25 , 36 , 45 
1013,the area of a triangle is with base 3 m and height 6 m ?,b,geometry, 88 m 2 , 9 m 2 , 66 m 2 , 77 m 2 , 31 m 2 
1014,if the perimeter of square region d and the perimeter of rectangular region r are equal and the sides of r are in the ratio 2 : 3 then the ratio of the area of r to the area of d,b,geometry, 25 : 16', 24 : 25', 5 : 6', 4 : 5', 4 : 9'] 
1015,if the perimeter of square region z and the perimeter of rectangular region r are equal and the sides of r are in the ratio 2 : 3 then the ratio of the area of r to the area of z,b,geometry, 25 : 16', 24 : 25', 5 : 6', 4 : 5', 4 : 9'] 
1016,"on dividing a number by 5 , we get 3 as remainder . what will the remainder when the square of the this number is divided by 5 ?",e,geometry, 0 , 5 , 8 , 9 , 4 
1017,find the area of a rhombus one side of which measures 20 cm and one diagonal is 24 cm .,d,geometry, 370 cm 2 , 365 cm 2 , 380 cm 2 , 384 cm 2 , 394 cm 2 
1018,"if y is the smallest positive integer such that 7,700 multiplied by y is the square of an integer , then y must be",e,geometry, 29 , 58 , 63 , 74 , 77 
1019,the side of a square is increased by 30 % then how much % does its area increases ?,b,geometry, 52.65 , 69 , 50.75 , 42.75 , 52.75 
1020,"if the length of the sides of two cubes are in the ratio 7 : 1 , what is the ratio of their total surface area ?",e,geometry, 7 : 1 , 14 : 1 , 21 : 1 , 42 : 1 , 49 : 1 
1021,how many pieces can a square pizza be cut into by making 5 linear cuts ?,a,geometry, 16 , 17 , 13 , 14 , 15 
1022,the area of a parallelogram is 128 sq m . then the area of a triangle formed by its diagonal is - - - - - - - - - - ?,b,geometry, 128 m', 64 m', 64 m ^ 2', 128 m ^ 2', none'] 
1023,the radius of a semicircle is 7 . what is the approximate perimeter of the semicircle ?,a,geometry, 36', 25', 15', 28', 37'] 
1024,one side of a rectangular field is 13 m and one of its diagonal is 17 m . find the area of the field .,b,geometry, 100 , 141.7 , 150 , 180 , none 
1025,a 45 ° - 45 ° - 90 ° right triangle has hypotenuse of length h . what is the area of the triangle t in terms of h ?,e,geometry, h / √ 2', h / 2', h / 4', ( h ) ^ 2', ( h ) ^ 2 / 4'] 
1026,the perimeter of a triangle is 40 cm and the in radius of the triangle is 2.5 cm . what is the area of the triangle ?,e,geometry, 76 , 88 , 66 , 55 , 50 
1027,"108 . triangle a ’ s base is 7 % greater than the base of triangle b , and a ’ s height is 7 % less than the height of triangle b . the area of triangle a is what percent less or more than the area of triangle b ?",e,geometry, 9 % less , 1 % less , equal to each other , 1 % more , 2.1 % more 
1028,"an artist wishes to paint a circular region on a square poster that is 5 feet on a side . if the area of the circular region is to be 1 / 2 the area of the poster , what must be the radius of the circular region in feet ?",d,geometry, 1 / pi , sqrt ( 2 / pi ) , 2 / sqrt ( pi ) , sqrt ( 12.5 / pi ) , pi / 2 
1029,"a rectangular parking space is marked out by painting three of its sides . if the length of the unpainted side is 9 feet , and the sum of the lengths of the painted sides is 37 feet , then what is the area of the parking space in square feet ?",c,geometry, 46', 81', 126', 252', none of these'] 
1030,"in a rectangular coordinate system , what is the area of a rhombus whose vertices have the coordinates ( 0 , 3.5 ) , ( 6 , 0 ) , ( 0 , - 3.5 ) , ( - 6 , 0 ) ?",a,geometry, 42 , 56 , 88 , 112 , 116 
1031,the perimeter of a triangle is 28 cm and the inradius of the triangle is 2.5 cm . what is the area of the triangle ?,e,geometry, 30', 31', 32', 34', 35'] 
1032,a box measuring 90 inches long by 45 inches wide by 9 inches deep is to be filled entirely with identical cubes . no space is to be left unfilled . what is the smallest number of cubes that can accomplish this objective ?,c,geometry, 17 , 18 , 50 , 108 , 864 
1033,the average length of the sides of triangle abc is 12 . what is the perimeter of triangle abc ?,e,geometry, 4', 6', 12', 24', 36'] 
1034,cubes with each side one inch long are glued together to form a larger cube . the larger cube ' s face is painted with red color and the entire assembly is taken apart . 23 small cubes are found with no paints on them . how many of unit cubes have at least one face that is painted red ?,e,geometry, 64', 72', 86', 98', 102'] 
1035,what is the % change in the area of a rectangle when its length increases by 25 % and its width decreases by 25 % ?,d,geometry, 0 % , 20 % increase , 20 % decrease , 6 % decrease , insufficient data 
1036,the number 90 can be written as the sum of the squares of 4 different positive integers . what is the sum of these 4 integers ?,b,geometry, 17 , 16 , 15 , 14 , 13 
1037,a rectangular of certain dimensions is chopped off from one corner of a larger rectangle as shown . ab = 8 cm and bc = 4 cm . the perimeter of the figure abcpqra ( in cm ) is :,a,geometry, 24', 28', 36', 48', none of these'] 
1038,"in a trapezium abcd , ab is parallel to dc , ab = 3 * dc , and the diagonals of the trapezium intersect at o . the ratio of the area of ∆ ocd to the area of ∆ oab is :",a,geometry, 1 : 9', 1 : 3', 3 : 1', 1 : 10', can not be determined'] 
1039,"the length of rectangle is thrice its breadth and its perimeter is 56 m , find the area of the rectangle ?",e,geometry, 432 , 212 , 252 , 992 , 147 
1040,"here is 15 dots . if you select 3 dots randomly , what is the probability that 3 dots make a triangle ?",b,geometry, 440 / 455 , 412 / 455 , 434 / 455 , 449 / 455 , 438 / 455 
1041,"what is the measure of the radius of the circle that circumscribes a triangle whose sides measure 11 , 60 and 61 ?",d,geometry, 6.5 , 12.5 , 28 , 30.5 , 40 
1042,"the length of rectangle is thrice its breadth and its perimeter is 112 m , find the area of the rectangle ?",d,geometry, 432 sq m , 356 sq m , 452 sq m , 588 sq m , 525 sq m 
1043,"in measuring the sides of a rectangle , one side is taken 5 % in excess and the other 4 % in deficit . find the error percent in the area , calculate from the those measurements .",b,geometry, 0.9 % , 0.8 % , 0.3 % , 0.2 % , 0.5 % 
1044,we have a rectangular metallic piece of paper that covers exactly the area of a cube . the length of the piece of paper is 144 inches and the width is 72 inches . what is the volume of the cube in cubic feet is 1 feet is 12 inches ?,a,geometry, a 216 , b 196 , c 170 , d 140 , e 121 
1045,"if the sum of a number and its square is 210 , what is the number ?",b,geometry, 16 , 14 , 25 , 87 , 171 
1046,"three interviewers , a , b , and c are interviewing 50 applicants . only with three interviewers ' admission can an applicant be admitted . if interviewer a admitted 20 applicants , b admitted 22 applicants , and c admitted 20 applicants , at least how many applicants get the admission ?",b,geometry, 4 , 0 , 6 , 8 , 12 
1047,"16 business executives and 7 chairmen meet at a conference . if each business executive shakes the hand of every other business executive and every chairman once , and each chairman shakes the hand of each of the business executives but not the other chairmen , how many handshakes would take place ?",c,geometry, 144 , 131 , 232 , 90 , 45 
1048,"if the sides of a triangle are 9 cm , 16 cm and 19 cm , what is its area ?",b,geometry, 69 , 72 , 75 , 89 , 93 
1049,the area of a rectangular field is equal to 200 square meters . its perimeter is equal to 60 meters . find the width of this rectangle .,b,geometry, 5 , 10 , 15 , 20 , 25 
1050,carmen made a sculpture from small pieces of wood . the sculpture is 2 feet 10 inches tall . carmen places her sculpture on a base that is 2 inches tall . how tall are the sculpture andbase together ?,d,geometry, 3.1 feet , 3.2 feet , 3.3 feet , 3.0 feet , 3.5 feet 
1051,the perimeter of a rectangle is equal to 280 meters . the ratio of its length to its width is 5 : 2 . find the area of the rectangle .,b,geometry, 400 square meters', 4000 square meters', 20 square meters', 2000 square meters', 1000 square meters'] 
1052,the area of sector of a circle whose radius is 18 metro and whose angle at the center is 42 â ° is ?,d,geometry, 52.6 , 52.9 , 52.8 , 118.8 , 52.2 
1053,"danny is sitting on a rectangular box . the area of the front face of the box is half the area of the top face , and the area of the top face is 1.5 times the area of the side face . if the volume of the box is 192 , what is the area of the side face of the box ?",e,geometry, 13 , 16 , 18 , 29 , 32 
1054,"the length of a rectangle is two - fifths of the radius of a circle . the radius of the circle is equal to the side of the square , whose area is 2500 sq . units . what is the area ( in sq . units ) of the rectangle if the rectangle if the breadth is 10 units ?",e,geometry, 140 , 150 , 160 , 170 , 200 
1055,the parameter of a square is equal to the perimeter of a rectangle of length 40 cm and breadth 20 cm . find the circumference of a semicircle whose diameter is equal to the side of the square . ( round off your answer to two decimal places ) ?,a,geometry, 47.14 , 45.15 , 43.23 , 41.44 , 41.51 
1056,the area of a circular field is 13.86 hectares . find the cost of fencing it at the rate of rs . 4.60 per metre .,e,geometry, 2399 , 3888 , 2999 , 5808 , 6072 
1057,"a rectangular photograph is surrounded by a border that is 1 inch wide on each side . the total area of the photograph and the border is m square inches . if the border had been 3 inches wide on each side , the total area would have been ( m + 52 ) square inches . what is the perimeter of the photograph , in inches ?",a,geometry, 10 , 36 , 38 , 40 , 42 
1058,the larger interior angle of a parallelogram is 90 ° more than its smaller interior angle . what is the measure of the smaller interior angle of the parallelogram ?,d,geometry, 90 ° , 75 ° , 60 ° , 45 ° , 30 ° 
1059,the area of a circular field is 17.56 hectares . find the cost of fencing it at the rate of rs . 5 per metre approximately,e,geometry, 4457 , 4567 , 4235 , 4547 , 7429 
1060,"a perfect square is defined as the square of an integer and a perfect cube is defined as the cube of an integer . how many positive integers n are there such that n is less than 5,000 and at the same time n is a perfect square and a perfect cube ?",c,geometry, 2 , 3 , 4 , 5 , 6 
1061,the water level in a rectangular swimming pool measuring 20 feet by 25 feet is to be lowered by 6 inches . how many gallons of water must be removed ? ( 1 cu ft = 7.5 gallons ),c,geometry, 100', 250', 1875', 1200', 5625'] 
1062,how can a cake ( circular ) be cut into 8 pieces by making just 3 cuts ?,a,geometry, 21', 787', 37', 26', 01'] 
1063,"the length and breadth of the floor of the room are 20 feet and 10 feet respectively . square tiles of 2 feet length of different colours are to be laid on the floor . black tiles are laid in the first row on all sides . if white tiles are laid in the one - third of the remaining and blue tiles in the rest , how many blue tiles will be there ?",a,geometry, 16', 24', 32', 48', none of these'] 
1064,the length of a rectangular plot is 10 mtr more than its width . the cost of fencing the plot along its perimeter at the rate of rs . 6.5 mtr is rs . 1430 . the perimeter of the plot is ?,e,geometry, 126 , 156 , 190 , 321 , 220 
1065,"a rectangular photograph is surrounded by a border that is 1 inch wide on each side . the total area of the photograph and the border is m square inches . if the border had been 5 inches wide on each side , the total area would have been ( m + 180 ) square inches . what is the perimeter of the photograph , in inches ?",a,geometry, 21 , 36 , 38 , 40 , 42 
1066,"the length of a rectangle is two third of the radius of a circle . the radius of the circle is equal to the side of the square , whose area is 4761 sq . units . what is the area ( in sq . units ) of the rectangle if the rectangle if the breadth is 13 units ?",a,geometry, 598 sq . units', 556 sq . units', 589 sq . units', 958 sq . units', 985 sq . units'] 
1067,the volume of the sphere qq is ( dfrac { 37 } { 64 } % ) less than thevolume of sphere pp and the volume of sphere rr is ( dfrac { 19 } { 27 } % ) less than that of sphere qq . by what is the surface areaof sphere rr less than the surfacearea of sphere pp ?,c,geometry, 40 %', 50 %', 75 %', 80 %', 90 %'] 
1068,"9 business executives and 7 chairmen meet at a conference . if each business executive shakes the hand of every other business executive and every chairman once , and each chairman shakes the hand of each of the business executives but not the other chairmen , how many handshakes would take place ?",c,geometry, 144 , 131 , 99 , 90 , 45 
1069,"if the length of rectangle is three times of its breadth . if the area of rectangle is 6075 sq . m , then calculate the length ?",b,geometry, 145', 135', 75', 140', none of these'] 
1070,"while visiting a small town in the united states , i lost my overcoat in a bus . when i reported the matter to the bus company i was asked the number of the bus . though i did not remember the exact number i did remember that the bus number bad a certain peculiarity about it . the number plate showed the bus number as a perfect square and also if the plate was turned upside down . ? the number would still be a perfect square — of course it was not ? i came to know from the bus company they had only 5 100 buses numbered from 1 to 500 . from this i was able to deduce the bus number . can you tell what was the other number .",b,geometry, 127 , 196 , 116 , 140 , 234 
