,Problem,correct,category,option_a,option_b,option_c,option_d,option_e
0,"a gardener is going to plant 2 red rosebushes and 2 white rosebushes . if the gardener is to select each of the bushes at random , one at a time , and plant them in a row , what is the probability that the 2 rosebushes in the middle of the row will be the red rosebushes ?",b,probability, 1 / 12 , 1 / 6 , 1 / 5 , 1 / 3 , ½ 
1,in a throw of dice what is the probability of ge æ « ng number greater than 3,a,probability, 1 / 2 , 1 / 3 , 1 / 5 , 1 / 6 , none of these 
2,"given a bag with 2 red balls and 3 yellow balls , you randomly select one of them , in order . if the second ball you take is yellow , what is the probability that the first one was also yellow ?",a,probability, 1 / 2 , 1 / 5 , 3 / 4 , 1 / 3 , 3 / 5 
3,"a bag contains 3 blue and 5 white marbles . one by one , marbles are drawn out randomly until only two are left in the bag . what is the probability that out of the two , one is white and one is blue ?",d,probability, 15 / 56 , 41 / 56 , 13 / 28 , 15 / 28 , 5 / 14 
4,in how many ways can 7 boys be seated in a circular order ?,c,probability, 110 , 230 , 720 , 420 , 680 
5,a coin is tossed 4 times . what is the probability of getting exactly 3 heads ?,b,probability, 1 / 2 , 1 / 4 , 1 / 8 , 1 / 16 , 3 / 16 
6,a number is selected at random from the first 30 natural numbers . what is the probability that the number is a multiple of either 5 or 12 ?,d,probability, 17 / 30 , 2 / 5 , 7 / 15 , 4 / 15 , 11 / 30 
7,"if a card is drawn from a well shuffled pack of cards , the probability of drawing a spade or a king is -",d,probability, 8 / 13 , 6 / 13 , 3 / 13 , 4 / 13 , 1 / 13 
8,"a certain junior class has 1000 students and a certain senior class has 900 students . among these students , there are 60 siblings pairs each consisting of 1 junior and 1 senior . if 1 student is to be selected at random from each class , what is the probability that the 2 students selected will be a sibling pair ?",b,probability, 3 / 40000 , 2 / 30000 , 9 / 2000 , 1 / 60 , 1 / 15 
9,"what is the probability that the sum of two dice will yield a 9 , and then when both are thrown again , their sum will again yield a 9 ? assume that each die has 8 sides with faces numbered 1 to 8 .",a,probability, 1 / 64 , 1 / 36 , 1 / 12 , 1 / 6 , 1 / 3 
10,4 dice are thrown simultaneously on the board . find the probability show the same face .,c,probability, 1 / 213 , 1 / 215 , 1 / 216 , 2 / 113 , 3 / 114 
11,"from a pack of 52 cards , 1 card is drawn at random . what is the probability that a jack , queen , or king is drawn ?",d,probability, 1 / 4 , 1 / 12 , 2 / 13 , 3 / 13 , 3 / 26 
12,in a throw of dice what is the probability of ge æ « ng number greater than 1,e,probability, 1 / 2 , 1 / 3 , 1 / 5 , 5 / 6 , none of these 
13,"there are 18 balls in a jar . you take out 3 blue balls without putting them back inside , and now the probability of pulling out a blue ball is 1 / 5 . how many blue balls were there in the beginning ?",e,probability, 12 , 9 , 8 , 7 , 6 
14,"the maitre ' d at an expensive manhattan restaurant has noticed that 60 % of the couples order dessert and coffee . however , 20 % of the couples who order dessert do n ' t order coffee . what is the probability w that the next couple the maitre ' d seats will not order dessert ?",b,probability, 20 % , 25 % , 40 % , 60 % , 75 % 
15,"if two dice are thrown together , the probability of getting an even number on one die and an odd number on the other is - .",b,probability, 1 / 3 , 1 / 2 , 7 / 8 , 3 / 4 , 7 / 3 
16,"a bag contains 3 red , 6 yellow and 8 green balls . 3 balls are drawn randomly . what is the probability that the balls drawn contain balls of different colours ?",d,probability, 2 / 7 , 3 / 5 , 3 / 11 , 18 / 85 , 7 / 16 
17,"an urn contains 5 red , 6 blue and 8 green balls . 3 balls are randomly selected from the urn , find the probability that the drawn ball are 2 blue and 1 red ?",a,probability, 25 / 323 , 21 / 969 , 28 / 989 , 74 / 879 , 23 / 589 
18,"in a certain animal population , for each of the first 3 months of life , the probability that an animal will die during that month is 1 / 6 . for a group of 200 newborn members of the population , approximately how many would be expected to survive the first 3 months of life ?",a,probability, 116 , 146 , 152 , 162 , 170 
19,"how many different ways can 2 students be seated in a row of 6 desks , so that there is always at least one empty desk between the students ?",d,probability, 2 , 3 , 4 , 20 , 12 
20,"a jar contains only red , yellow , and orange marbles . if there are 3 red , 6 yellow , and 4 orange marbles , and 3 marbles are chosen from the jar at random without replacing any of them , what is the probability that 2 yellow , 1 red , and no orange marbles will be chosen ?",e,probability, 1 / 60 , 1 / 45 , 2 / 45 , 3 / 22 , 5 / 22 
21,"if 2 cards are selected at random from the deck of 52 cards then what is the probability of one of the selected cards will be king and other will be 10 ? a deck of cards has a total of 52 cards , consisting of 4 suits ; ( spades ( black ) , hearts ( red ) , diamond ( red ) s , and clubs ( black ) ) ; and 13 cards including 1 king , 1 queen and 1 jack in each suit",b,probability, 8 / 2652 , 18 / 2652 , 1 / 2652 , 12 / 2652 , 16 / 2652 
22,a card is drawn from a pack of 52 cards . the probability of getting a queen of spade or an ace of club is :,b,probability, 1 / 13 , 1 / 26 , 2 / 13 , 1 / 52 , 1 / 48 
23,"when 3 fair coins are tossed together , what is the probability of getting 2 tails ?",a,probability, 1 / 2 , 1 / 3 , 1 / 4 , 3 / 4 , 2 / 3 
24,"a bag contains 3 blue and 5 white marbles . one by one , marbles are drawn out randomly until only two are left in the bag . what is the probability x that out of the two , one is white and one is blue ?",d,probability, 15 / 56 , 41 / 56 , 13 / 28 , 15 / 28 , 5 / 14 
25,"if 4 people are selected from a group of 6 married couples , what is the probability that none of them would be married to each other ?",d,probability, 1 / 33 , 2 / 33 , 1 / 3 , 16 / 33 , 11 / 12 
26,in a throw of a coin find the probability of getting a tail ?,a,probability, 1 / 2 , 1 / 3 , 1 / 4 , 2 / 5 , 2 / 7 
27,in how many ways can 5 people be arranged in a circle ?,c,probability, 2 ! , 5 ! , 4 ! , 3 ! , 6 ! 
28,"a certain club has 10 members , including parry . one of the 10 members is chosen at random to be the president , one of the remaining 9 members is to be chosen at random to be the secretary , and one of the remaining 8 members is to be chosen at random to be the treasurer . what is the probability that parry will be either the member chose to be secretary or the member chose to be treasurer ?",e,probability, 1 / 720 , 1 / 80 , 1 / 10 , 1 / 9 , 1 / 5 
29,"there is a 30 % chance sandy will visit china this year , while there is a 60 % chance that she will visit malaysia this year . what is the probability that sandy will visit either china or malaysia this year , but not both ?",c,probability, 42 % , 48 % , 54 % , 60 % , 66 % 
30,"kim has 8 pairs of shoes ; each pair is a different color . if kim randomly selects 2 shoes without replacement from the 16 shoes , what is the probability that she will select 2 shoes of the same color ?",e,probability, 2 / 5 , 1 / 5 , 1 / 9 , 1 / 10 , 1 / 15 
31,a number is selected at random from the first 30 natural numbers . what is the probability that the number is a multiple of either 2 or 19 ?,d,probability, 17 / 30 , 2 / 5 , 7 / 15 , 8 / 15 , 11 / 30 
32,"a bag contains 20 red jellybeans and 20 blue jellybeans . if 3 jellybeans are removed one at a time , at random and are not replaced , what is the probability that all 3 jellybeans removed from the bag are blue ?",d,probability, 9 / 100 , 2 / 19 , 1 / 8 , 3 / 20 , 3 / 10 
33,"kim has 9 pairs of shoes ; each pair is a different color . if kim randomly selects 2 shoes without replacement from the 18 shoes , what is the probability that she will select 2 shoes of the same color ?",d,probability, 2 / 5 , 11 / 5 , 1 / 9 , 1 / 17 , 1 / 5 
34,"a bag contains 2 white marbles and 2 black marbles . if each of 2 girls and 2 boys randomly selects and keeps a marble , what is the probability that all of the girls select the same colored marble ?",c,probability, 1 / 35 , 1 / 10 , 1 / 3 , 1 / 4 , 1 / 5 
35,the main line train starts at 5.00 am and the harbor line train starts at 5.02 am . each train has the frequency of 10 minutes . if a guy goes in the morning at a random time what is the probability of he getting main line train ?,e,probability, . 5 , 0.6 , 0.4 , 0.7 , 0.8 
36,what is the probability of getting sum of 10 on rolling three dices ?,b,probability, 28 / 216 , 27 / 216 , 29 / 216 , 26 / 216 , 25 / 216 
37,find the probability that a leap year selected at random will not have 53 sundays or mondays .,c,probability, 6 / 7 , 5 / 7 , 4 / 7 , 3 / 7 , 2 / 7 
38,what is the probability of drawn an ace or a space or both from a dew of cards .,c,probability, 14 / 52 , 15 / 52 , 16 / 52 , 17 / 52 , 18 / 52 
39,two unbiased coins are tossed . find the probability of getting two heads ?,c,probability, 1 / 2 , 1 / 3 , 1 / 4 , 2 / 3 , 3 / 5 
40,"kim has 7 pairs of shoes ; each pair is a different color . if kim randomly selects 2 shoes without replacement from the 14 shoes , what is the probability that she will select 2 shoes of the same color ?",a,probability, 1 / 13 , 1 / 15 , 11 / 9 , 1 / 10 , 1 / 25 
41,"a certain junior class has 1,000 students and a certain senior class has 400 students . among these students , there are 60 siblings pairs , each consisting of 1 junior and 1 senior . if 1 student is to be selected at random from each class , what is the probability that the 2 students selected at will be a sibling pair ?",a,probability, 3 / 20, 1 / 3, 9 / 2, 1 / 60 , 1 / 15 
42,"three unbiased coins are tossed . what is the probability of getting 1 heads , 1 tail ?",e,probability, 3 / 4 , 1 / 4 , 3 / 8 , 7 / 8 , 2 / 8 
43,"there are 7 books on a shelf , of which 2 are paperbacks and 5 are hardbacks . how many possible selections of 4 books from this shelf include at least one paperback ?",a,probability, a ) 30 , b ) 45 , c ) 50 , d ) 55 , e ) 60 
44,there are 4 red shoes & 6 green shoes . if two of red shoes are drawn what is the probability of getting red shoes,d,probability, 1 / 13 , 1 / 14 , 1 / 2 , 2 / 15 , 2 / 16 
45,"from a group of 5 boys and 5 girls , 6 children are to be randomly selected . what is the probability that 3 boys and 3 girls will be selected ?",d,probability, 4 / 15 , 6 / 17 , 8 / 19 , 10 / 21 , 12 / 23 
46,a fair coin is tossed 3 times . what is the probability of getting at least 2 tails ?,c,probability, 3 / 4 , 3 / 2 , 1 / 2 , 3 / 4 , 1 / 4 
47,"a box contains 4 red balls and 4 black balls . one by one , every ball is selected at random without replacement . what is the probability that the fourth ball selected is black ?",e,probability, 1 / 4 , 1 / 2 , 1 / 2 , 5 / 8 , 2 
48,"a jar contains 3 black , 3 white and 1 green balls . if you pick two balls at the same time , what ' s the probability that one ball is black and one is white ?",d,probability, 2 / 7 , 5 / 7 , 4 / 7 , 3 / 7 , 1 / 2 
49,"in a certain animal population , for each of the first 3 months of life , the probability that an animal will die during that month is 1 / 8 . for a group of 200 newborn members of the population , approximately how many would be expected to survive the first 3 months of life ?",a,probability, 134 , 146 , 152 , 162 , 170 
50,in 15 year ’ s time the combined age of my 4 brothers will be 107 . what will it be in 6 year ’ s time ?,c,probability, 65 , 87 , 71 , 60 , 66 
51,"a , b , c , d , e sitting in a row what is the probability that a & b sitting adjacent .",b,probability, 1 / 5 , 2 / 5 , 3 / 5 , 4 / 5 , 6 / 5 
52,"on a ranch , a rancher can place a loop of rope , called a lasso , once in every 2 throws around a cow ’ s neck . what is the probability that the rancher will be able to place a lasso around a cow ’ s neck at least once in 3 attempts ?",c,probability, 3 / 4 , 5 / 8 , 7 / 8 , 9 / 16 , 15 / 16 
53,in how many ways 3 boys and 3 girls can be seated in a row so that they are alternate .,c,probability, 144 , 288 , 36 , 256 , none 
54,"in a garden , there are yellow and green flowers which are straight and curved . if the probability of picking a green flower is 1 / 6 and picking a straight flower is 1 / 2 , then what is the probability of picking a flower which is yellow and straight",d,probability, 1 / 7 , 1 / 8 , 1 / 4 , 3 / 7 , 7 / 8 
55,three 6 faced dice are thrown together . the probability that no two dice show the same number on them is,b,probability, 5 / 0 , 5 / 9 , 5 / 1 , 5 / 3 , 5 / 6 
56,"a meeting has to be conducted with 6 managers . find the number of ways in which the managers be selected from among 10 managers , if 2 managers will not attend the meeting together ?",d,probability, 120 , 110 , 105 , 140 , 135 
57,"there are 4 books on a shelf , of which 3 are paperbacks and 6 are hardbacks . how many possible selections of 4 books from this shelf include at least one paperback ?",e,probability, a ) 40 , b ) 45 , c ) 50 , d ) 55 , e ) 111 
58,three unbiased coins are tossed . what is the probability of getting at least 2 heads ?,b,probability, 1 / 4 , 1 / 2 , 1 / 3 , 1 / 8 , 1 / 6 
59,a bag contains 6 black and 8 white balls . one ball is drawn at random . what is the probability that the ball drawn is white ?,b,probability, 3 / 4 , 4 / 7 , 1 / 7 , 1 / 8 , 4 / 3 
60,three unbiased coins are tossed . what is the probability of getting at most two heads ?,d,probability, 3 / 4 , 1 / 4 , 3 / 8 , 7 / 8 , none of these 
61,two 6 faced dice are thrown together . the probability that all the three show the same number on them is ?,b,probability, 1 / 32 , 1 / 6 , 1 / 33 , 1 / 38 , 1 / 34 
62,"if x is to be chosen at random from the set { 1 , 2 , 3 , 4 } and y is to be chosen at random from the set { 5 , 6 } , what is the probability that xy will be even ?",b,probability, 1 / 6 , 1 / 3 , 1 / 2 , 2 / 3 , 5 / 6 
63,lola rolls a die 3 times . what is the probability that she gets a 4 on the last one of the 3 rolls ?,a,probability, 215 / 216 , 216 , 1 / 216 , none , 2 
64,what is the probability q of randomly selecting an arrangement of the letters of the wordmediterraneanin which the first letter is e and the last letter is r ?,c,probability, 1 / 13 , 1 / 20 , 1 / 26 , 1 / 50 , 1 / 100 
65,"two cards are drawn together from a pack of 52 cards . the probability that one is a club and other is a diamond , is :",d,probability, 29 / 34 , 47 / 100 , 3 / 20 , 13 / 102 , none of these 
66,two dice are thrown simultaneously . what is the probability of getting two numbers whose product is even ?,c,probability, 1 / 2 , 3 / 8 , 3 / 4 , 5 / 16 , 9 / 16 
67,what is the probability of randomly selecting one of the shortest diagonals from all the diagonals of a regular hexagon ?,d,probability, 1 / 4 , 1 / 3 , 1 / 2 , 2 / 3 , 7 / 9 
68,there are 4 red shoes & 4 green shoes . if two of red shoes are drawn what is the probability of getting red shoes,c,probability, 1 / 3 , 1 / 14 , 3 / 14 , 1 / 15 , 1 / 16 
69,a card is drawn from a pack of 52 cards . the probability of getting a queen of club or a king of heart is :,a,probability, 1 / 26 , 1 / 52 , 2 / 62 , 2 / 26 , 3 / 26 
70,"a bag contains 3 red , 4 black and 2 white balls . what is the probability of drawing a red and a white ball in two successive draws , each ball being put back after it is drawn ?",d,probability, 2 / 27 , 1 / 9 , 1 / 3 , 4 / 27 , 2 / 9 
71,"if a coin is flipped , the probability that the coin will land tails is 1 / 2 . if the coin is flipped 3 times , what is the probability that it will land tails up on the first flip and not on the last 2 flips ?",a,probability, 1 / 8 , 1 / 4 , 1 / 3 , 1 / 2 , 3 / 4 
72,"a box contains 3 red balls and 4 black balls . one by one , every ball is selected at random without replacement . what is the probability that the fourth ball selected is black ?",a,probability, 7 / 4 , 1 / 2 , 1 / 2 , 5 / 8 , 2 / 3 
73,"if two integers x , y ( x > y ) are selected from - 10 to 5 ( inclusive ) , how many possible cases are there ?",b,probability, 105 , 120 , 190 , 210 , 240 
74,"a bag consists of 20 marbles , of which 5 are blue , 9 are red , and the remainder are white . if lisa is to select a marble from the bag at random , what is the probability that the marble will be red or white ?",a,probability, 3 / 4 , 2 / 4 , 1 / 4 , 1 / 8 , 1 / 16 
75,"three unbiased coins are tossed , what is the probability of ge ƫ ng at least 2 tails ?",c,probability, 1 / 3 , 1 / 6 , 1 / 2 , 1 / 8 , none of these 
76,"how many positive integers less than 300 can be formed using the numbers 1 , 2 , 3 and 5 for the digits ?",b,probability, 48 , 52 , 66 , 68 , 84 
77,"a certain junior class has 1,000 students and a certain senior class has 600 students . among these students , there are 60 siblings pairs , each consisting of 1 junior and 1 senior . if 1 student is to be selected at random from each class , what is the probability that the 2 students selected at will be a sibling pair ?",b,probability, 3 / 40, 1 / 10, 9 / 2, 1 / 60 , 1 / 15 
78,"a question paper has 2 parts , a & b , each containing 10 questions . if a student has to choose 8 from part a & 5 from part b , in how many ways can he choose the questions ?",e,probability, 1100 , 1200 , 1235 , 1354 , 1140 
79,jane and thomas are among the 9 people from which a committee of 4 people is to be selected . how many different possible committees of 4 people can be selected from these 9 people if at least one of either jane or thomas is to be selected ?,e,probability, 67 , 73 , 79 , 85 , 91 
80,"a meeting has to be conducted with 4 managers . find the number of ways in which the managers may be selected from among 7 managers , if there are 2 managers who refuse to attend the meeting together .",c,probability, 18 , 21 , 25 , 30 , 35 
81,in how many ways 4 boys and 1 girls can be seated in a row so that they are alternate .,c,probability, 144 , 288 , 24 , 256 , none 
82,three coins are tossed . find the probability of at most 2 tails ?,d,probability, 1 / 2 , 1 / 4 , 2 / 3 , 7 / 8 , 3 / 8 
83,"if a certain coin is flipped , the probability that the coin will land heads is 1 / 2 . if the coin is flipped 6 times , what is the probability that it will land heads up on the first 3 flips but not on the last 3 flips ?",d,probability, 1 / 8 , 1 / 16 , 1 / 32 , 1 / 64 , 1 / 128 
84,what is the probability of getting exactly 4 heads in a single throw of five fair coins ?,d,probability, 1 / 4 , 3 / 8 , 3 / 16 , 5 / 32 , 7 / 32 
85,in how many ways 4 boys and 5 girls can be seated in a row so that they are alternate .,e,probability, 144 , 288 , 12 , 256 , 2880 
86,an unbaised coin is tossed until it shows up the same face in 2 consicative throws wat is the probability that the no of tosses is not more than 4 .,c,probability, 3 / 4 , 1 / 4 , 7 / 8 , 1 / 8 , 6 / 8 
87,"in a bag containing 3 balls , a white ball was placed and then 1 ball was taken out at random . what is theprobability that the extracted ball would turn onto be white , if all possible hypothesisconcerning the color of the balls that initially in the bag were equally possible ?",b,probability, 3 / 5 , 5 / 8 , 6 / 7 , 7 / 8 , 6 / 7 
88,"from a group of 3 women and 3 girls , 4 are to be randomly selected . what is the probability that equal numbers of women and girls will be selected ?",a,probability, 3 / 5 , 1 / 5 , 2 / 5 , 4 / 5 , 1 
89,what is the probability of getting at least one six in a single throw of three unbiased dice ?,e,probability, 1 / 6 , 125 / 216 , 1 / 36 , 81 / 216 , 91 / 216 
90,"from a pack of 52 cards , two cards are drawn together at random . what is the probability of both the cards being kings ?",d,probability, 1 / 15 , 25 / 57 , 35 / 256 , 1 / 221 , 2 / 15 
91,"x , y , and z are all unique numbers . if x is chosen randomly from the set { 8 , 9 , 10 , 11 } and y and z are chosen randomly from the set { 20 , 21 , 22 , 23 } , what is the probability that x and y are prime and z is not ?",a,probability, 1 / 16 , 3 / 11 , 13 / 20 , 3 / 10 , 1 / 10 
92,"a bag consists of 60 marbles , of which 5 are blue , 9 are red , and the remainder are white . if lisa is to select a marble from the bag at random , what is the probability that the marble will be red or white ?",a,probability, 11 / 12 , 2 / 4 , 1 / 4 , 1 / 8 , 1 / 16 
93,"a meeting has to be conducted with 4 managers . find the number of ways in which the managers may be selected from among 8 managers , if there are 2 managers who refuse to attend the meeting together .",b,probability, 48 , 55 , 58 , 62 , 70 
94,"when tossed , a certain coin has an equal probability of landing on either side . if the coin is tossed 4 times , what is the probability that it will land on the same side each time ?",c,probability, 1 / 4 , 1 / 6 , 1 / 8 , 1 / 12 , 1 / 16 
95,"a bag contains 10 red jellybeans and 10 blue jellybeans . if 3 jellybeans are removed one at a time , at random and are not replaced , what is the probability q that all 3 jellybeans removed from the bag are blue ?",b,probability, 9 / 100 , 2 / 19 , 1 / 8 , 3 / 20 , 3 / 10 
96,two unbiased coins are tossed . what is the probability of getting two heads ?,b,probability, 1 / 2 , 1 / 4 , 2 / 3 , 1 / 5 , 2 / 7 
97,"a question paper has 2 parts , a & b , each containing 5 questions . if a student has to choose 3 from part a & 4 from part b , in how many ways can he choose the questions ?",a,probability, 50 , 100 , 152 , 150 , 55 
98,"find the probability that a number selected from numbers 1 , 2 , 3 , . . . , 50 is a prime number , when each of the given numbers is equally likely to be selected ?",b,probability, 10 / 50 , 15 / 50 , 8 / 50 , 3 / 50 , 7 / 50 
99,"a question paper has 2 parts , a & b , each containing 10 questions . if a student has to choose 5 from part a & 10 from part b , in how many ways can he choose the questions ?",e,probability, 100 , 120 , 125 , 350 , 252 
100,"a meeting has to be conducted with 5 managers . find the number of ways in which the managers be selected from among 8 managers , if 2 managers will not attend the meeting together ?",b,probability, 40 , 36 , 42 , 45 , 47 
101,"on a ranch , a rancher can place a loop of rope , called a lasso , once in every 2 throws around a cow ’ s neck . what is the probability that the rancher will be able to place a lasso around a cow ’ s neck at least once in 4 attempts ?",e,probability, 3 / 4 , 5 / 8 , 7 / 8 , 11 / 16 , 15 / 16 
102,there are 6 different travelers who each have a choice of vacationing at one of 10 different destinations . what is the probability that all 6 travelers will end up vacationing at the same destination ?,d,probability, 0.1 , 0.001 , 0.0002 , 1.0 e - 05 , 0.0001 
103,"find the probability that a number selected from numbers 1 , 2 , 3 , . . . , 20 is a prime number , when each of the given numbers is equally likely to be selected ?",c,probability, 10 / 20 , 1 / 20 , 8 / 20 , 3 / 20 , 7 / 20 
104,what is the probability of getting exactly 2 heads in a single throw of five fair coins ?,d,probability, 1 / 4 , 3 / 8 , 3 / 16 , 5 / 16 , 11 / 32 
105,"a jar contains only red , yellow , and orange marbles . if there are 3 red , 3 yellow , and 4 orange marbles , and 3 marbles are chosen from the jar at random without replacing any of them , what is the probability that 2 yellow , 1 red , and no orange marbles will be chosen ?",c,probability, 1 / 60 , 1 / 45 , 2 / 45 , 3 / 22 , 5 / 22 
106,"45 girls and 60 boys are present at a party . there are 17 girl - boy are in relationship among them . if a girl and a boy is selected at random , what is the probability that they will be a couple ?",d,probability, 1 / 200 , 1 / 100 , 90 / 2900 , 17 / 2700 , 1 / 20 
107,"a quiz has one mcq question with a , b and c as options . and two questions with true / false answers . what is the probability of giving all 3 answers correct ?",a,probability, 1 / 12 , 1 / 3 , 1 / 4 , 1 / 2 , 1 / 6 
108,"a bag contains 6 red , 2 yellow and 4 green balls . 3 balls are drawn randomly . what is the probability that the balls drawn contain balls of different colours ?",a,probability, 12 / 55 , 3 / 5 , 3 / 11 , 1 / 4 , 7 / 16 
109,"when tossed , a certain coin has equal probability of landing on either side . if the coin is tossed 3 times , what is the probability that it will land on the same side each time ?",b,probability, 1 / 8 , 1 / 4 , 1 / 3 , 3 / 8 , 1 / 2 
110,in how many ways 4 boys and 3 girls can be seated in a row so that they are alternative ?,b,probability, 120 , 144 , 160 , 210 , 180 
111,"when you draw 2 dices together , find the probability of getting a total of 6 ?",c,probability, 3 / 13 , 2 / 31 , 5 / 36 , 7 / 41 , 7 / 43 
112,"wink , inc . follows a certain procedure that requires two tasks to be finished independently in order for a job to be done . on any given day , there is a 7 / 8 probability that task 1 will be completed on time , and a 1 / 5 probability that task 2 will be completed on time . on a certain day , what is the probability that task 1 will be completed on time , but task 2 will not ?",d,probability, 1 / 20 , 3 / 40 , 13 / 40 , 7 / 10 , 13 / 22 
113,"when tossed , a certain coin has an equal probability of landing on either side . if the coin is tossed 5 times , what is the probability that it will land on the same side each time ?",d,probability, 1 / 6 , 1 / 8 , 1 / 12 , 1 / 16 , 1 / 32 
114,"x , y , and z are all unique numbers . if x is chosen randomly from the set { 5 , 6 , 7 , 8 , 9 , 10 , 11 } and y and z are chosen randomly from the set { 20 , 21 , 22 , 23 } , what is the probability that x and y are prime and z is not ?",e,probability, 1 / 5 , 3 / 20 , 1 / 7 , 2 / 15 , 3 / 28 
