,Problem,correct,category,option_a,option_b,option_c,option_d,option_e
0,"a rectangular floor that measures 15 meters by 18 meters is to be covered with carpet squares that each measure 3 meters by 3 meters . if the carpet squares cost $ 12 apiece , what is the total cost for the number of carpet squares needed to cover the floor ?",c,geometry, $ 200 , $ 240 , $ 360 , $ 960 , $ 1
1,"d and e are two points respectively on sides ab and ac of triangle abc such that de is parallel to bc . if the ratio of area of triangle ade to that of the trapezium decb is 144 : 25 and bc = 13 cm , then find the length of de .",c,geometry, 12 , 13 , 14 , 11 , 15 
2,"the perimeter of an equilateral triangle is 60 . if one of the sides of the equilateral triangle is the side of an isosceles triangle of perimeter 45 , then how long is the base of isosceles triangle ?",a,geometry, 5 units , 10 units , 15 units , 20 units , 25 units 
3,"a small table has a length of 12 inches and a breadth of b inches . cubes are placed on the surface of the table so as to cover the entire surface . the maximum side of such cubes is found to be 4 inches . also , a few such tables are arranged to form a square . the minimum length of side possible for such a square is 80 inches . find b .",b,geometry, 8', 16', 24', 32', 48'] 
4,a right triangle is inscribed in a circle . the legs of the triangle have lengths 6 and 8 . what is the diameter of the circle ?,d,geometry, 8', 8 π', 9 √ 3', 10', 12'] 
5,"four equal circles are described about the four corners of a square so that each touches two of the others . if a side of the square is 14 cm , then the area enclosed between the circumferences of the circles is :",b,geometry, 24 cm 2', 42 cm 2', 154 cm 2', 196 cm 2', none of these'] 
6,"george ' s car calls for 8 ounces of oil for each cylinder used . his car ' s engine has 6 cylinders . if 16 ounces of oil has already been put into the engine used , then how many additional ounces of oil are needed ?",d,geometry, 16', 48', 64', 32', 8'] 
7,what is the area of square field whose side of length 13 m ?,a,geometry, 169 , 196 , 266 , 288 , 261 
8,"a metallic sheet is of rectangular shape with dimensions 50 m x 30 m . from each of its corners , a square is cut off so as to make an open box . if the length of the square is 5 m , the volume of the box ( in m cube ) is :",e,geometry, 4120 m cube , 4140 m cube , 5140 m cube , 5120 m cube , none of these 
9,the number 219 can be written as sum of the squares of 3 different positive integers . what is the sum of these 3 different integers ?,b,geometry, 20 , 21 , 19 , 17 , 15 
10,"eight cubes , each with a volume of 512 cm ^ 3 , are joined to form one large cube . what is the surface area of the large cube ?",b,geometry, 4096 sq cm', 1536 sq cm', 1024 sq cm', 2048 sq cm', 512 sq cm'] 
11,"the length of a rectangle is twice its breadth . if its lengthis decreased by 5 cm & breadth is increased by 5 cm , the area of the rectangle is increased by 75 sq . cm . what is the length of the rectangle ?",c,geometry, 25 cm , 30 cm , 40 cm , 45 cm , 60 cm 
12,"a cube of edge 12 cm is immersed completely in a rectangular vessel containing water . if the dimensions of the base of vessel are 20 cm * 15 cm , find the rise in water level ?",a,geometry, 5.76 cm , 8.25 cm , 11.25 cm , 15.12 cm , 20.62 cm 
13,the radius of a cylindrical vessel is 9 cm and height is 3 cm . find the whole surface of the cylinder ?,e,geometry, 308 sq cm , 220 sq cm , 440 sq cm , 132 sq cm , 678.8 sq cm 
14,"a rectangular floor that measures 24 meters by 64 meters is to be covered with carpet squares that each measure 8 meters by 8 meters . if the carpet squares cost $ 24 apiece , what is the total cost for the number of carpet squares needed to cover the floor ?",b,geometry, $ 200', $ 576', $ 480', $ 960', $ 1
15,"abcd is a square . e and f are the midpoints of sides cd and bc , respectively . what is the ratio of the shaded region area to the unshaded region ?",d,geometry, 1 : 1', 2 : 1', 3 : 1', 5 : 3', 8 : 3'] 
16,"a rectangular lawn of dimensions 80 m * 40 m has two roads each 10 m wide running in the middle of the lawn , one parallel to the length and the other parallel to the breadth . what is the cost of traveling the two roads at rs . 3 per sq m ?",c,geometry, 2288 , 2779 , 3300 , 3900 , 2781 
17,"can c and can в are both right circular cylinders . the radius of can c is twice the radius of can b , while the height of can c is half the height of can b . if it costs $ 4.00 to fill half of can b with a certain brand of gasoline , how much would it cost to completely fill can c with the same brand of gasoline ?",e,geometry, $ 1 , $ 2 , $ 4 , $ 8 , $ 16 
18,"if the sides of a square are multiplied by 5 , the area of the original square is how many times as large as the area of the resultant square ?",a,geometry, 4 % , 25 % , 50 % , 200 % , 400 % 
19,a cubical block of metal weighs 8 pounds . how much will another cube of the same metal weigh if its sides are twice as long ?,e,geometry, 48 , 32 , 24 , 18 , 64 
20,"if the area of a circle is 25 pi square feet , find its circumference .",a,geometry, 10 pi feet , 28 pi feet , 38 pi feet , 48 pi feet , 58 pi feet 
21,"the sides of a square region , measured to the nearest centimeter , are 9 centimeters long . the least possible value of the actual area of the square region is",c,geometry, 60.25 sq cm , 66.25 sq cm , 56.25 sq cm , 72.25 sq cm , 58.25 sq cm 
22,the area of a rhombus is equal to the area of a square whose side length is 8 cm . if one of the diagonals is 16 cm what is the length of other diagonal ?,b,geometry, 4', 8', 12', 16', 20'] 
23,cuboid volume and base area are 144 m ^ 3 and 18 m ^ 3 respectively . find the height of a cuboid ?,d,geometry, 5 m', 12 m', 6 m', 8 m', 10 m'] 
24,"if anangletis defined as 1 percent of 1 degree , then how many anglets are there in one half circle ?",d,geometry, 0.36 , 3.6 , 360 , 18, 36
25,"an iron cube of side 10 cm is hammered into a rectangular sheet of thickness 0.5 cm . if the sides of the sheet are in the ratio 1 : 5 , the sides are :",a,geometry, 10 cm 20 cm', 2 cm 10 cm', 100 cm 20 cm', 30 cm 100 cm', none'] 
26,a cubical block of metal weighs 4 pounds . how much will another cube of the same metal weigh if its sides are twice as long ?,b,geometry, 48 , 32 , 24 , 18 , 12 
27,"if the length of the sides of two cubes are in the ratio 4 : 1 , what is the ratio of their total surface area ?",d,geometry, 4 : 1', 6 : 1', 8 : 1', 16 : 1', 64 : 1'] 
28,a rectangular swimming pool is 8 feet by 20 feet . a deck that has uniform width surrounds the pool . the total area of the pool and deck is 540 square feet . what is the width of the deck ?,e,geometry, 1 , 2 , 3 , 4 , 5 
29,"a rectangular grass field is 85 m * 55 m , it has a path of 2.5 m wide all round it on the outside . find the area of the path and the cost of constructing it at rs . 2 per sq m ?",a,geometry, 1450 , 1971 , 9676 , 1679 , 2691 
30,the diagonal of a rhombus are 25 m and 50 m . its area is :,d,geometry, 900 , 800 , 700 , 625 , 650 
31,what is the angle between the hands of a clock when time is 10 : 20 ?,a,geometry, 90 deg , 75 deg , 45 deg , 15 deg , 30 deg 
32,the diameter of a cylindrical tin is 14 cm and height is 5 cm . find the volume of the cylinder ?,d,geometry, 230 , 141 , 66 , 245 , 21 
33,the ratio of the volumes of two cubes is 125 : 216 . what is the ratio of their total surface areas ?,a,geometry, 13 : 18 , 8 : 12 , 1 : 12 , 8 : 17 , 1 : 11 
34,the water level in a rectangular swimming pool measuring 40 feet by 25 feet is to be lowered by 6 inches . how many gallons of water must be removed ? ( 1 cu ft = 7.5 gallons ),d,geometry, 100 , 250 , 750 , 3750 , 5625 
35,the volume of a cube is 1728 cc . find its surface .,a,geometry, 864 , 556 , 255 , 287 , 267 
36,"the length of rectangle is thrice its breadth and its perimeter is 40 m , find the area of the rectangle ?",c,geometry, 432 , 212 , 75 , 992 , 212 
37,a 25 cm wide path is to be made around a circular garden having a diameter of 4 meters . approximate area of the path is square meters is ?,a,geometry, 3.34 sq m , 98.8 sq m , 67.8 sq m , 27.9 sq m , 19.9 sq m 
38,"in an electric circuit , two resistors with resistances m and n are connected in parallel . in this case , if p is the combined resistance of these two resistors , then the reciprocal of p is equal to the sum of the reciprocals of m and n . what is p in terms of m and n ?",b,geometry, ( n - m )', mn / ( m + n )', ( nm )', ( n - m ) / ( m + n )', none of these'] 
39,"an order was placed for a carpet whose length and width were in the ratio of 3 : 2 . subsequently , the dimensions of the carpet were altered such that its length and width were in the ratio 1 : 1 but were was no change in its perimeter . what is the ratio of the areas of the carpets ?",e,geometry, 4 : 5 , 9 : 10 , 14 : 15 , 19 : 20 , 24 : 25 
40,"a circular swimming pool is surrounded by a concrete wall 4 ft wide . if the area of the concrete wall surrounding the pool is 11 / 25 that of the pool , then the radius of the pool is ?",b,geometry, 22 , 20 , 88 , 387 , 19 
41,a certain rectangular crate measures 12 feet by 16 feet by 18 feet . a cylindrical gas tank is to be made for shipment in the crate and will stand upright when the crate is placed on one of its six faces . what should the radius of the tank be if it is to be of the largest possible volume ?,d,geometry, 4', 5', 6', 8', 10'] 
42,the length of a rectangular plot is 10 mtr more than its width . the cost of fencing the plot along its perimeter at the rate of rs . 6.5 mtr is rs . 910 . the perimeter of the plot is ?,d,geometry, 126 , 156 , 190 , 140 , 260 
43,what will be the ratio between the area of a rectangle and the area of a triangle with one of the sides of rectangle as base and a vertex on the opposite side of rectangle .,b,geometry, 1 : 2 , 2 : 1 , 3 : 1 , data inadequate , none of these 
44,a man walking at the rate of 6 km per hour crosses a square field diagonally in 9 seconds the area of the field is,c,geometry, 110 sq . m', 111.5 aq . m', 112.5 sq . m', 114 sq . m', none of these'] 
45,the area of a triangle is with base 4 m and height 5 m ?,b,geometry, 11', 10', 99', 17', 12'] 
46,"if a square mirror has a 20 - inch diagonal , what is the approximate perimeter e of the mirror , in inches ?",b,geometry, 40', 60', 80', 100', 120'] 
47,the side of a square is increased by 25 % then how much % does its area increases ?,b,geometry, 56.28 , 56.25 , 56.2 , 56.24 , 56.21 
48,"hall is 15 m long and 12 m broad . if the sum of the areas of the floor and the ceiling is equal to the sum of the areas of four walls , the volume of the hall is :",c,geometry, 720', 900', 1200', 1800', 2100'] 
49,"abcd is a square . f and e are the midpoints of sides ad and cd , respectively . the area of triangle fed is 2 square inches . what is the area of square abcd ( in square inches ) ?",c,geometry, 4', 8', 16', 32', 64'] 
50,"the length of a rectangular plot is thrice its breadth . if the area of the rectangular plot is 972 sq m , then what is the breadth of the rectangular plot ?",c,geometry, 16 , 17 , 18 , 19 , 14 
51,what is the area of a square field whose diagonal of length 24 m ?,a,geometry, 240 sq m , 250 sq m , 200 sq m , 400 sq m , 800 sq m 
52,"if the radius of a circle is increased by 12 % , then the area of the circle",b,geometry, decreases by 25.44 %', increases by 25.44 %', no change in area', decreases by 12 %', none'] 
53,what is the area of a square field whose sides have a length of 12 meters ?,c,geometry, 225 sq m , 126 sq m , 144 sq m , 267 sq m , 231 sq m 
54,"108 . triangle a ’ s base is 9 % greater than the base of triangle b , and a ’ s height is 9 % less than the height of triangle b . the area of triangle a is what percent less or more than the area of triangle b ?",d,geometry, 9 % less , 1 % less , equal to each other , 1.3 % more , 9 % more 
55,"in a rectangular coordinate system , what is the area of a rhombus whose vertices have the coordinates ( 0 , 3.5 ) , ( 7 , 0 ) , ( 0 , - 3.5 ) , ( - 7 , 0 ) ?",d,geometry, 56 , 88 , 112 , 49 , 120 
56,"if two sides of a triangle are 6 and 13 , respectively , which of the following could not be the area of this triangle ?",a,geometry, 40', 6', 17', 29', 38'] 
57,the surface area of a sphere is same as the curved surface area of a right circular cylinder whose height and diameter are 6 cm each . the radius of the sphere is,a,geometry, 3 cm , 4 cm , 6 cm , 8 cm , none 
58,the area of a triangle is with base 8 m and height 4 m ?,c,geometry, 88 m 2 , 10 m 2 , 16 m 2 , 77 m 2 , 31 m 2 
59,"a cylinder with 6 meter radius and 12 meter height is filled to capacity with water . if the content of the cylinder is used to fill several smaller cylinders of 4 meter diameter and 8 meter height , how many smaller cylinders will be filled to capacity ?",a,geometry, 13', 12', 4', 16', 18'] 
60,"a rectangular garden is to be twice as long as it is wide . if 900 yards of fencing , including the gate , will completely enclose the garden , what will be the length of the garden , in yards ?",e,geometry, 40 , 50 , 60 , 200 , 300 
61,what is the smallest positive integer x such that 864 x is the cube of a positive integer,e,geometry, 6 , 12 , 9 , 5 , 2 
62,what is the area of an equilateral triangle whose one side length is 80 ?,e,geometry, 800 √ 3 , 1000 √ 3 , 1200 √ 3 , 1400 √ 3 , 1600 √ 3 
63,"if each edge of a cube is doubled , then its volume :",a,geometry, becomes 8 times', becomes 9 times', is double', becomes 6 times', none'] 
64,carmen made a sculpture from small pieces of wood . the sculpture is 2 feet 10 inches tall . carmen places her sculpture on a base that is 4 inches tall . how tall are the sculpture andbase together ?,a,geometry, 3.17 feet', 3.2 feet', 3.3 feet', 3.4 feet', 3.5 feet'] 
65,"if the space diagonal of cube c is 5 inches long , what is the length , in inches , of the diagonal of the base of cube c ?",b,geometry, 5 / ( √ 6 )', 5 · √ ( 2 / 3 )', 5 · √ ( 3 / 2 )', 5 · √ 3', 5 · √ 6'] 
66,"if a 3 cm cube is cut into 1 cm cubes , then what is the percentage increase in the surface area of the resulting cubes ?",d,geometry, 40 % , 100 % , 150 % , 200 % , 300 % 
67,if the height of a cone is increased by 190 % then its volume is increased by ?,d,geometry, 100 , 777 , 998 , 190 , 2879 
68,the parameter of a square is equal to the perimeter of a rectangle of length 16 cm and breadth 14 cm . find the circumference of a semicircle whose diameter is equal to the side of the square . ( round off your answer to two decimal places ),e,geometry, 77.14 cm', 47.14 cm', 84.92 cm', 94.94 cm', 23.57 cm'] 
69,"you buy a piece of land with an area of â ˆ š 625 , how long is one side of the land plot ?",e,geometry, 28 , 29 , 30 , 31 , 25 
70,a rectangular box 60 m long and 40 m wide has two concrete crossroads running in the middle of the box and rest of the box has been used as a lawn . the area of the lawn is 2109 sq . m . what is the width of the road ?,a,geometry, 3 m', 4 m', 5 m', 6 m', 2 m'] 
71,"in may , the grounds keeper at spring lake golf club built a circular green with an area of 25 square feet . in august , he doubled the distance from the center of the green to the edge of the green . what is the total area of the renovated green ?",a,geometry, 100 pi , 80 , 70 , 60 , 50 
72,"in the xy - plane , a triangle has vertices ( 0,0 ) , ( 4,0 ) and ( 4,10 ) . if a point ( a , b ) is selected at random from the triangular region , what is the probability that a - b > 0 ?",e,geometry, 1 / 5 , 1 / 3 , 1 / 2 , 2 / 3 , 2 / 5 
73,"right triangle pqr is the base of the prism in the figure above . if pq = pr = â ˆ š 14 and the height of the prism is 8 , what is the volume of the prism ?",d,geometry, 12 , 45 , 87 , 56 , 23 
74,a rectangular swimming pool is 20 feet by 28 feet . a deck that has uniform width surrounds the pool . the total area of the pool and deck is 884 square feet . what is the width of the deck ?,c,geometry, 2 feet , 2.5 feet , 3 feet , 4 feet , 5 feet 
75,"three table runners have a combined area of 224 square inches . by overlapping the runners to cover 80 % of a table of area 175 square inches , the area that is covered by exactly two layers of runner is 24 square inches . what is the area of the table that is covered with three layers of runner ?",e,geometry, 18 square inches , 20 square inches , 24 square inches , 28 square inches , 30 square inches 
76,"the radius of a cylinder is 8 m , height 13 m . the volume of the cylinder is :",b,geometry, 2200 , 2614.9 , 3300 , 1100 , 4400 
77,tough and tricky questions : number properties . what is the smallest positive integer x such that 1512 x is the cube of a positive integer ?,e,geometry, 7 , 14 , 28 , 35 , 49 
78,find the area of a parallelogram with base 24 cm and height 16 cm .,b,geometry, 379 , 384 , 345 , 342 , 376 
79,"a certain cube floating in a bucket of water has between 80 and 85 percent of its volume below the surface of the water . if between 8 and 15 cubic centimeters of the cube ' s volume is above the surface of the water , then the length of a side of the cube is approximately",b,geometry, 3 , 4 , 7 , 8 , 9 
80,a circular logo is enlarged to fit the lid of a jar . the new diameter is 10 per cent larger than the original . by what percentage has the area of the logo increased ?,e,geometry, 50 , 80 , 100 , 125 , 21 
81,"a rectangular lawn of length 200 m by 120 m has two roads running along its center , one along the length and the other along the width . if the width of the roads is 5 m what is the area t covered by the two roads ?",c,geometry, 400 , 1550 , 1575 , 1600 , 1625 
82,the diagonal of a rectangle is 41 cm and its area is 20 sq . cm . the perimeter of the rectangle must be :,a,geometry, 18 cm', 28 cm', 30 cm', 38 cm', 42 cm'] 
83,the diagonals of a rhombus are 11 cm and 20 cm . find its area ?,e,geometry, 329 , 288 , 150 , 238 , 110 
84,"a metallic sheet is of rectangular shape with dimensions 48 m x 36 m . from each of its corners , a square is cut off so as to make an open box . if the length of the square is 5 m , the volume of the box ( in m 3 ) is :",a,geometry, 4940 , 5120 , 6420 , 8960 , 7960 
85,"a rectangular lawn of dimensions 80 m * 60 m has two roads each 15 m wide running in the middle of the lawn , one parallel to the length and the other parallel to the breadth . what is the cost of traveling the two roads at rs . 3 per sq m ?",e,geometry, a ) 3820 , b ) 930 , c ) 9309 , d ) 3900 , e ) 5625 
86,what is the area of square field whose side of length 8 m ?,b,geometry, 225 , 64 , 772 , 882 , 21 
87,the area of a square is equal to five times the area of a rectangle of dimensions 36 cm * 20 cm . what is the perimeter of the square ?,d,geometry, 289 cm , 800 cm , 829 cm , 240 cm , 289 cm 
88,"each of the 39 points is placed either inside or on the surface of a perfect sphere . if 72 % or fewer of the points touch the surface , what is the maximum number of segments which , if connected from those points to form chords , could be the diameter of the sphere ?",d,geometry, 7 , 11 , 13 , 14 , 38 
89,"in the coordinate plane , one of the vertices of a square is the point ( - 4 , - 4 ) . if the diagonals of that square intersect at point ( 3 , 2 ) , what is the area of that square ?",b,geometry, 180 , 196 , 160 , 164 , 172 
90,"a square mirror has exactly half the area of the rectangular wall on which it is hung . if each side of the mirror is 24 inches and the width of the wall is 42 inches , what is the length of the wall , in inches ?",e,geometry, 21.4 , 23.4 , 25.4 , 26.4 , 27.4 
91,in a certain parallelogram the degree measure of one angle exceeds that of the other by 10 what is the degree measure of the smaller angle ?,c,geometry, 75 , 80 , 85 , 90 , 95 
92,what is the area of square field whose side of length 7 m ?,e,geometry, 225 , 662 , 772 , 882 , 49 
93,"16 meters of wire is available to fence off a flower bed in the form of a circular sector . what must the radius of the circle in meters be , if we wish to have a flower bed with the greatest possible surface area ?",b,geometry, 2 √ 2 , 4 , 5 , 4 √ 2 , none of these 
94,"if each side of a rectangle is increased by 100 % , by what % the area increases ?",d,geometry, 100 %', 200 %', 250 %', 300 %', 400 %'] 
95,"if the length of a certain rectangle is decreased by 4 cm and the width is increased by 3 cm , a square with the same area as the original rectangle would result . find the perimeter of the original rectangle ?",d,geometry, 76 , 27 , 19 , 50 , 11 
96,a square carpet with an area 169 m 2 must have 2 metres cut - off one of its edges in order to be a perfect fit for a rectangular room . what is the area of rectangular room ?,d,geometry, 180 m 2', 164 m 2', 152 m 2', 143 m 2', none of these'] 
97,the edge of a cube is 5 a cm . find its surface ?,a,geometry, 150 a 2 cm 2 , 170 a 2 cm 2 , 125 a 2 cm 2 , 175 a 2 cm 2 , 120 a 2 cm 2 
98,a ring x of diameter 16 inches is placed inside another ring y of diameter of 18 inches . how much fraction of the ring x surface is not covered by the ring y ?,e,geometry, 13 / 15', 12 / 4', 16 / 17', 22 / 16', 17 / 81'] 
99,the area of a triangle is with base 4.5 m and height 6 m ?,c,geometry, 11 m 2 , 10 m 2 , 13.5 m 2 , 19 m 2 , 12.5 m 2 
100,cubes with each side one inch long are glued together to form a larger cube . the larger cube ' s face is painted with red color and the entire assembly is taken apart . 24 small cubes are found with no paints on them . how many of unit cubes have at least one face that is painted red ?,e,geometry, 64 , 72 , 86 , 98 , 101 
101,"if the sum of a number and its square is 240 , what is the number ?",a,geometry, 15 , 77 , 25 , 87 , 171 
102,the diagonals of a rhombus are 30 cm and 12 cm . find its area ?,c,geometry, 176 , 190 , 180 , 278 , 292 
103,if the sides of a cube are in the ratio 4 : 3 . what is the ratio of their diagonals ?,a,geometry, 4 : 3 , 4 : 8 , 4 : 1 , 4 : 2 , 4 : 7 
104,"two equilateral triangle of side 12 cm are placed one on top another , such a 6 pionted star is formed if the six vertices lie on a circle what is the area of the circle not enclosed by the star ?",a,geometry, 21', 88937', 269', 279', 2701'] 
105,the area of a parallelogram is 1764 sq m and its base is nine times size of the corresponding altitude . then the length of the base is ?,d,geometry, 21 , 9 , 11 , 14 , 7 
106,"paper charge is rs . 60 per kg . how much expenditure would be there to cover a cube of edge 10 m with a paper , if one kg of paper covers 20 sq . m . area ?",d,geometry, rs . 2250', rs . 3600', rs . 2700', rs . 1800', none of these'] 
107,how many odd numbers between 10 and 900 are the squares of integers ?,b,geometry, 12 , 13 , 14 , 15 , 16 
108,triangle atriangle b are similar triangles with areas 1536 units square and 1734 units square respectively . the ratio of there corresponding height would be,d,geometry, 9 : 10 , 17 : 19 , 23 : 27 , 16 : 17 , 15 : 23 
109,the radius of a cylindrical vessel is 7 cm and height is 1 cm . find the whole surface of the cylinder ?,a,geometry, 352 , 771 , 440 , 767 , 1981 
110,"what positive number , when squared , is equal to the cube of the positive square root of 17 ?",c,geometry, 64', 32', 8', 4', 2'] 
111,"rectangle a has sides a and b , and rectangle b has sides c and d . if a / c = b / d = 2 / 5 , what is the ratio of rectangle a ’ s area to rectangle b ’ s area ?",e,geometry, 2 / 5 , 2 / 25 , 5 / 2 , 5 / 4 , 4 / 25 
112,a cylinder is being filled with sand weighing 200 kg per cubic foot . the cylinder has a diameter of 1 foot and is 5 feet tall . how much sand is being used ? ?,a,geometry, 250 pi kg', 500 pi kg', 500 pi ^ 2 kg', 1000 pi kg', 1000 pi ^ 2 kg'] 
113,"find the curved surface area , if the radius of a cone is 28 m and slant height is 30 m ?",b,geometry, 2550 , 2640 , 3960 , 4280 , 5490 
114,"three table runners have a combined area of 220 square inches . by overlapping the runners to cover 80 % of a table of area 175 square inches , the area that is covered by exactly two layers of runner is 24 square inches . what is the area of the table that is covered with three layers of runner ?",d,geometry, 18 square inches , 20 square inches , 24 square inches , 28 square inches , 30 square inches 
115,an isosceles triangle with sides 13 13 10 and there is a circle inscribed it . find the radius of circle ?,b,geometry, 1.32', 3.33', 3.58', 4.34', 5.18'] 
116,the diagonals of a rhombus are 10 cm and 15 cm . find its area ?,a,geometry, 75 , 129 , 150 , 123 , 117 
117,"a rectangular floor is covered by a rug except for a strip 3 meters wide along each of the four edge . if the floor is 12 meters by 10 meters , what is the area of the rug in square meters ?",e,geometry, 30 , 28 , 36 , 42 , 24 
118,the area of a square field is 576 km 2 . how long will it take for a horse to run around at the speed of 12 km / h ?,c,geometry, 12 h , 10 h , 8 h , 6 h , none of these 
119,find the area of a rhombus whose side is 25 cm and one of the diagonals is 30 cm ?,a,geometry, 600', 881', 767', 261', 121'] 
120,"in a parallelogram , the length of one diagonal and the perpendicular dropped on that diagonal are 30 and 20 metres respectively . find its area",a,geometry, 600 m 2', 540 m 2', 680 m 2', 574 m 2', none of these'] 
121,find the area of the quadrilateral of one of its diagonals is 24 cm and its off sets 9 cm and 6 cm ?,a,geometry, 180 cm 2 , 150 cm 2 , 168 cm 2 , 198 cm 2 , 987 cm 2 
122,"a rectangular photograph is surrounded by a border that is 1 inch wide on each side . the total area of the photograph and the border is m square inches . if the border had been 4 inches wide on each side , the total area would have been ( m + 90 ) square inches . what is the perimeter of the photograph , in inches ?",a,geometry, 10 , 20 , 30 , 40 , 50 
