,Problem,correct,category,option_a,option_b,option_c,option_d,option_e
491,"what is the total surface area in square meters of a rectangular solid whose length is 10 meters , width is 9 meters , and depth is 6 meters ?",c,geometry, 400 m 2 , 404 m 2 , 408 m 2 , 401 m 2 , 412 m 2 
492,"f and e are midpoints of ab and ad respectively . if the side of square abcd is 8 , what is the area of triangle cef ?",e,geometry, 8 √ 2', 9 √ 3', 18', 16 √ 2', 24'] 
493,find the area of a parallelogram with base 60 cm and height 16 cm ?,a,geometry, 960 cm 2 , 240 cm 2 , 480 cm 2 , 45 cm 2 , 250 cm 2 
494,in front of you lies a figure made up with 20 x 10 square blocks . will you be able to find out the number of unique squares and rectangles that are being formed inside this figure by combining two or more distinct squares ?,b,geometry, 11647', 11550', 12654', 26537', 32651'] 
495,the sides of the triangle are in the ratio 1 / 2 : 1 / 3 : 1 / 4 and its perimeter is 104 cm . the length of the longest side is ?,b,geometry, 32 cm', 48 cm', 50 cm', 28 cm', 30 cm'] 
496,the area of a square is equal to five times the area of a rectangle of dimensions 20 cm * 16 cm . what is the perimeter of the square ?,b,geometry, 289 cm , 160 cm , 829 cm , 288 cm , 289 cm 
497,find the area of a parallelogram with base 32 cm and height 18 cm ?,a,geometry, 576 cm 2 , 384 cm 2 , 672 cm 2 , 267 cm 2 , 286 cm 2 
498,"if the sum of a number and its square is 132 , what is the number ?",b,geometry, 15 , 11 , 28 , 91 , none of these 
499,what should be added to 4440 so that it may become a perfect square ?,e,geometry, 44', 45', 46', 47', 49'] 
500,a cubical block of metal weighs 5 pounds . how much will another cube of the same metal weigh if its sides are twice as long ?,b,geometry, 48', 40', 24', 18', 12'] 
501,"the ratio of the radius of two circles is 2 : 3 , and then the ratio of their areas is ?",c,geometry, 1 : 7', 2 : 9', 4 : 9', 3 : 7', 3 : 4'] 
502,"the area of a square garden is q square feet and the perimeter is p feet . if q = 2 p + 20 , what is the perimeter of the garden in feet ?",c,geometry, 32', 36', 40', 44', 48'] 
503,a volume of 11780 l water is in a container of sphere . how many hemisphere of volume 4 l each will be required to transfer all the water into the small hemispheres ?,e,geometry, 2812 , 8231 , 2734 , 4222 , 2945 
504,"when magnified 1,000 times by an electron microscope , the image of a certain circular piece of tissue has a diameter of 0.2 centimeter . the actual diameter of the tissue , in centimeters , is",e,geometry, 0.005 , 0.002 , 0.001 , 0.0005 , 0.0002 
505,"square x is inscribed in circle y . if the perimeter of x is 64 , what is the circumference of y ?",a,geometry, 16 √ 2 π', 8 √ 2 π', 22 √ 2 π', 12 √ 2 π', 9'] 
506,"in measuring the sides of a rectangle , one side is taken 16 % in excess and other 5 % in deficit . find the error percentage in the area calculated from these measurements .",c,geometry, 3.5 % , 2.4 % , 10.2 % , 5 % , 2.6 % 
507,a making a cube with dimension 5 * 5 * 5 using 1 * 1 * 1 cubes . what is the number of cubes needed to make hollow cube looking of the same shape .,a,geometry, 98', 99', 100', 101', 102'] 
508,the number 49 can be written as the sum of the squares of 3 different positive integers . what is the sum of these 3 integers ?,a,geometry, 11 , 16 , 15 , 14 , 13 
509,find the area of a parallelogram with base 18 cm and height 16 cm ?,e,geometry, 423 cm 2 , 122 cm 2 , 420 cm 2 , 251 cm 2 , 288 cm 2 
510,"a football field is 9600 square yards . if 800 pounds of fertilizer are spread evenly across the entire field , how many pounds of fertilizer were spread over an area of the field totaling 3600 square yards ?",e,geometry, 450 , 600 , 750 , 2400 , 300 
511,"three interviewers , x , y , and z are interviewing 40 applicants . only with three interviewers ' admission can an applicant be admitted . if interviewer x admitted 15 applicants , y admitted 17 applicants , and z admitted 20 applicants , at least how many applicants get the admission ?",a,geometry, 0', 2', 6', 8', 12'] 
512,the breath of a rectangular landscape is 8 times its length . there is a playground in it whose area is 3200 square mtr & which is 1 / 9 rd of the total landscape . what is the breath of the landscape ?,e,geometry, 420', 430', 280', 360', 480'] 
513,the area of a square field is 1225 km 2 . how long will it take for a horse to run around at the speed of 20 km / h ?,a,geometry, 7 h , 10 h , 8 h , 6 h , none of these 
514,"if a rectangular room measures 8 meters by 5 meters by 4 meters , what is the volume of the room in cubic centimeters ? ( 1 meter = 100 centimeters )",b,geometry, 24, 16 , 2 , 24 , 240 
515,"if the area of the equilateral triangle above is 0.75 , what is the area of the adjacent square ?",b,geometry, ( √ 3 ) / 2', √ 3', √ 6', 3', 2 √ 3'] 
516,"it has been raining at the rate of 5 centimeters per hour . if the rain filled a cylindrical drum with a depth of 15 centimeters , and area 300 square centimeters , how long did it take to fill the drum completely ?",a,geometry, 3 hours', 4 hours 15 minutes', 6 hours', 2 hours 5 minutes', 8 hours'] 
517,the diameter of a cylindrical tin is 10 cm and height is 5 cm . find the volume of the cylinder ?,a,geometry, 125 , 155 , 130 , 120 , 100 
518,the diameter of a cylindrical tin is 14 cm and height is 2 cm . find the volume of the cylinder ?,e,geometry, 33 , 45 , 66 , 77 , 98 
519,what is the area of a square field whose diagonal of length 16 m ?,a,geometry, 128 , 289 , 200 , 112 , 178 
520,find the circumference and area of radius 13 cm .,b,geometry, 124 cm ² , 531 cm ² , 354 cm ² , 584 cm ² , 594 cm ² 
521,"a snooker tournament charges $ 40.00 for vip seats and $ 15.00 for general admission ( “ regular ” seats ) . on a certain night , a total of 300 tickets were sold , for a total cost of $ 7,500 . how many fewer tickets were sold that night for vip seats than for general admission seats ?",d,geometry, 190 , 180 , 150 , 200 , 300 
522,"in a rectangular axis system , what is the area of a parallelogram with the coordinates : ( 3,5 ) , ( 9,5 ) , ( 2,7 ) , ( 8,7 ) ?",d,geometry, 21 . , 28 . , 35 . , 12 . , 52 . 
523,there is a square with sides of 13 . what is the area of the biggest circle that can be cut out of this square ?,a,geometry, 132.73 , 231.92 , 530.93 , 113.1 , 204.33 
524,"a metallic sheet is of rectangular shape with dimensions 48 m x 36 m . from each of its corners , a square is cut off so as to make an open box . if the length of the square is 7 m , the volume of the box ( in m 3 ) is :",b,geometry, 4830 , 5236 , 6420 , 8960 , 7960 
525,the diagonal of a rhombus are 40 m and 30 m . its area is :,a,geometry, 600', 450', 350', 500', 620'] 
526,"a snooker tournament charges $ 40.00 for vip seats and $ 15.00 for general admission ( “ regular ” seats ) . on a certain night , a total of 320 tickets were sold , for a total cost of $ 7,500 . how many fewer tickets were sold that night for vip seats than for general admission seats ?",a,geometry, 212 , 200 , 220 , 230 , 240 
527,"the area of a rectangle is 360 sq . m . if its length is increased by 10 m and its width is decreased by 6 m , then its area does not change . find the perimeter of the original rectangle .",c,geometry, 74 m', 75 m', 76 m', 77 m', 78 m'] 
528,"in measuring the sides of a rectangle , one side is taken 7 % in excess , and the other 6 % in deficit . find the error percent in the area calculated from these measurements .",e,geometry, 0.11 % , 0.7 % , 0.4 % , 0.6 % , 0.58 % 
529,how many squares are there between 2011 to 2300 ? ? ? ?,a,geometry, 3', 4', 5', 6', 7'] 
530,the perimeter of a triangle is 20 cm and the inradius of the triangle is 3 cm . what is the area of the triangle ?,b,geometry, 22 , 30 , 77 , 54 , 23 
531,"if a cube has a volume of 125 , what is the surface area of one side ?",b,geometry, 5', 25', 50', 150', 625'] 
532,"right triangle pqr is the base of the prism in the figure above . if pq = pr = â ˆ š 5 and the height of the prism is 10 , what is the volume of the prism ?",e,geometry, 5', 10', 15', 20', 25'] 
533,the length of a rectangle is doubled while its width is doubled . what is the % change in area ?,b,geometry, 250 % , 300 % , 500 % , 650 % , 700 % 
534,what is the ratio between perimeters of two squares one having 2.5 times the diagonal then the other ?,c,geometry, 4 : 5 , 1 : 3 , 2.5 : 1 , 3.5 : 1 , 3 : 2 
535,all the faces of a cube are painted with blue colour . then it is cut into 125 small equal cubes . how many small cubes will be formed having only one face coloured ?,a,geometry, 54 , 8 , 16 , 24 , 34 
536,the radius of a cylinder is 2 r units and height is 3 r units . find the curved surface ?,b,geometry, 18 π r 2 , 12 π r 2 , 3 π r 2 , 6 π r 2 , 9 π r 2 
537,"a math teacher has 26 cards , each of which is in the shape of a geometric figure . half of the cards are rectangles , and a third of the cards are rhombuses . if 8 cards are squares , what is the maximum possible number of cards that re circles .",a,geometry, 9 , 10 , 11 , 12 , 13 
538,"a rectangular courty 3.78 metres long and 5.25 metres wide is to be paved exactly with square tiles , all of the same size . what is the largest size of the tile which could be used for the purpose ?",b,geometry, 14 cms', 21 cms', 42 cms', none of these', can not be determined'] 
539,the diagonal of a rhombus are 80 m and 120 m . its area is :,c,geometry, 4500 , 4000 , 4800 , 4600 , 4320 
540,"a rectangular field has a length 10 meters more than it is width . if the area of the field is 144 , what is the length ( in meters ) of the rectangular field ?",b,geometry, 16 , 18 , 20 , 22 , 24 
541,"a crate measures 4 feet by 8 feet by 12 feet on the inside . a stone pillar in the shape of a right circular cylinder must fit into the crate for shipping so that it rests upright when the crate sits on at least one of its six sides . what is the radius , in feet , of the pillar with the largest volume that could still fit in the crate ?",d,geometry, 2 , 4 , 6 , 8 , 12 
542,"an equilateral triangle t 2 is formed by joining the mid points of the sides of another equilateral triangle t 1 . a third equilateral triangle t 3 is formed by joining the mid - points of t 2 and this process is continued indefinitely . if each side of t 1 is 45 cm , find the sum of the perimeters of all the triangles .",d,geometry, 180 cm , 220 cm , 240 cm , 270 cm , 300 cm 
543,find the perimeter and area of a square of side 19 cm .,b,geometry, 324 , 361 , 400 , 441 , 484 
544,the volumes of two cones are in the ratio 1 : 30 and the radii of the cones are in the ratio of 1 : 2 . what is the length of the wire ?,a,geometry, 6 : 5 , 6 : 9 , 6 : 2 , 2 : 2 , 2 : 8 
545,"the radius of a cylinder is 10 m , height 12 m . the volume of the cylinder is :",d,geometry, 2200 , 5500 , 3300 , 3771.4 , 4400 
546,there are 7 non - collinear points . how many triangles can be drawn by joining these points ?,c,geometry, 22 , 38 , 35 , 29 , 18 
547,"three rugs have a combined area of 196 square meters . by overlapping the rugs to cover floor area of 140 square meters , the area that is covered by exactly two layers of rug is 24 square meters . what is the area that is covered with three layers of rug ?",a,geometry, 15 square meters , 20 square meters , 24 square meters , 28 square meters , 30 square meters 
548,"if the sides of a triangle are 30 cm , 40 cm and 50 cm , what is its area ?",d,geometry, 400 , 500 , 550 , 600 , 700 
549,"the area of an equilateral triangle is subtracted from its base , and the perimeter is then added to this total , the result is 4 . what is the height of the equilateral triangle if its base is 2 ?",c,geometry, 2', 3', 4', 5', 6'] 
550,find the area of a parallelogram with base 34 cm and height 18 cm ?,d,geometry, 198 cm 2 , 384 cm 2 , 510 cm 2 , 612 cm 2 , 680 cm 2 
551,"in the rectangular coordinate system , points ( 8 , 0 ) and ( – 8 , 0 ) both lie on circle c . what is the maximum possible value of the radius of c ?",c,geometry, 2', 4', 8', 16', none of the above'] 
552,"a circular rim a having a diameter of 45 inches is rotating at the rate of x inches / min . another circular rim b with a diameter of 30 inches is rotating at the rate of y inches / min . what is the value of y in terms of x , if both the rims reach their starting positions at the same time after every rotation .",a,geometry, 3 x / 2', 4 x / 5', 7 x / 5', 5 x / 7', 3 x / 4'] 
553,"a lady builds 10 cm length , 18 cm width , and 4 cm height box using 12 cubic cm cubes . what is the minimum number of cubes required to build the box ?",d,geometry, 107 , 70 , 78 , 60 , 111 
554,the diagonal of the floor of a rectangular closet is 7 feet . the shorter side of the closet is 4 feet . what is the area of the closet in square feet ?,b,geometry, 20 sq . ft', 27 sq . ft', 37 sq . ft', 47 sq . ft', 57 sq . ft'] 
555,a rectangular block 12 cm by 20 cm by 36 cm is cut into an exact number of equal cubes . find the least possible number of cubes ?,a,geometry, 135 , 10 , 15 , 40 , 22 
556,"there are 60 slots around a circle , numbered 1 to 60 . a man starts fromthe first slot and jumps to the 5 th slot . from there he jumps to the 9 th slot andso on . in which slot will he land in his 2200 th jump ?",c,geometry, 1', 5', 41', 45', 46'] 
557,"what is the smallest positive perfect square that is divisible by 9 , 15 , and 25 ?",b,geometry, 100 , 225 , 900 , 1, 4
558,the diagonal of a rectangle is cm and its area is 20 sq . cm . the perimeter of the rectangle must be :,a,geometry, 18', 77', 625', 276', 191'] 
559,what is the ratio between perimeters of two squares one having 4 times the diagonal then the other ?,d,geometry, 3 : 8 , 3 : 6 , 3 : 7 , 4 : 1 , 3 : 3 
560,"calculate the area of a triangle , if the sides are 13 cm , 12 cm and 5 cm , what is its area ?",c,geometry, 36 cm 2', 35 cm 2', 30 cm 2', 32 cm 2', 31 cm 2'] 
561,the number 46 can be written as the sum of the squares of 3 different positive integers . what is the sum of these 3 integers ?,d,geometry, 17 , 16 , 15 , 10 , 13 
562,in a certain circle there are 9 points . what is the number of the triangles connecting 4 points of the 9 points ?,d,geometry, 80', 96', 108', 126', 132'] 
563,if the height of a cone is increased by 100 % then its volume is increased by ?,c,geometry, 200 % , 300 % , 100 % , 500 % , 350 % 
564,"34 . the side surface of a cylinder is rolled with a rectangle . if the height of a cylinder is 16 feet and the perimeter of the circular base . is 12 feet , what is the diagonal of the rectangle ?",b,geometry, 16', 20', 18', 22', 21'] 
565,two cubes of tire sides ratio 2 : 3 . find its cube volumes ratio ?,d,geometry, 2 : 27', 3 : 27', 1 : 27', 8 : 27', 5 : 27'] 
566,"a rectangular pig farm has a fence along three sides and a wall along the fourth side . the fenced side opposite the wall is twice the length of each of the other two fenced sides . if the area of the rectangular region is 1250 square feet , what is the total length of the fence , in feet ?",d,geometry, 25', 50', 100', 150', 200'] 
567,"by combining number of small cubes , a larger cube is produced . the ratio between volume of larger cube and small cube is 1000 : 8 then how many small cubes are required to produce a larger cube ?",d,geometry, 100', 2', 5', 125', 80'] 
568,"the area of a triangle will be when a = 2 m , b = 5 m , c = 7 m , a , b , c being lengths of respective sides ?",b,geometry, 2 , 7 , 5 , 3 , 4 
569,in a certain circle there are 10 points . what is the number of the triangles connecting 2 points of the 10 points ?,b,geometry, 40 , 45 , 108 , 120 , 132 
570,abcd is a square where ab = â ˆ š 6000 . let x be a point on ab and y be a point on cd such that ax = cy . compute the area of trapezoid axyd .,e,geometry, 3008 , 2002 , 1008 , 2016 , 3000 
571,"the length of a rectangle is one - sixth of the radius of a circle . the radius of the circle is equal to the side of the square , whose area is 1296 sq . units . what is the area ( in sq . units ) of the rectangle if the rectangle if the breadth is 10 units ?",b,geometry, 560 sq . units', 360 sq . units', 260 sq . units', 460 sq . units', 160 sq . units'] 
572,"a small table has a length of 12 inches and a breadth of b inches . cubes are placed on the surface of the table so as to cover the entire surface . the maximum side of such cubes is found to be 4 inches . also , a few such tables are arranged to form a square . the minimum length of side possible for such a square is 24 inches . find b .",a,geometry, 8 , 16 , 24 , 32 , 48 
573,"if the area of a square with sides of length 4 centimeters is equal to the area of a rectangle with a width of 4 centimeters , what is the length of the rectangle , in centimeters ?",d,geometry, 14 , 8 , 12 , 4 , 18 
574,"three walls have wallpaper covering a combined area of 300 square meters . by overlapping the wallpaper to cover a wall with an area of 180 square meters , the area that is covered by exactly two layers of wallpaper is 30 square meters . what is the area that is covered with three layers of wallpaper ?",d,geometry, 5 square meters , 36 square meters , 42 square meters , 45 square meters , 120 square meters 
575,the two sides of a triangle are 32 and 68 . the area is 960 sq . cm . find the third side of triangle ?,c,geometry, 45', 50', 60', 70', 80'] 
576,the perimeter of one face of a cube is 48 cm . its volume will be :,e,geometry, 125 cm 3 , 400 cm 3 , 250 cm 3 , 625 cm 3 , none of these 
577,62 small identical cubes are used to form a large cube . how many more cubes are needed to add one top layer of small cube all over the surface of the large cube ?,d,geometry, 64 , 128 , 152 , 154 , 256 
578,"can n and can в are both right circular cylinders . the radius of can n is twice the radius of can b , while the height of can n is half the height of can b . if it costs $ 4.00 to fill half of can b with a certain brand of gasoline , how much would it cost to completely fill can n with the same brand of gasoline ?",e,geometry, $ 1', $ 2', $ 4', $ 8', $ 16'] 
579,"if the sides of a triangle are 39 cm , 36 cm and 15 cm , what is its area ?",d,geometry, 120 cm 2 , 765 cm 2 , 216 cm 2 , 270 cm 2 , 275 cm 2 
580,"obra drove 120 π meters along a circular track . if the area enclosed by the circular track on which she drove is 57,600 π square meters , what percentage of the circular track did obra drive ?",d,geometry, 6.67 % , 12.5 % , 18.75 % , 25 % , 33.3 % 
581,"if paint costs $ 3.20 per quart , and a quart covers 1200 square feet , how much will it cost to paint the outside of a cube 10 feet on each edge ?",a,geometry, $ 1.60', $ 16.00', $ 96.00', $ 108.00', $ 196.00'] 
582,"in a triangle abc , ab = 6 , bc = 8 and ac = 10 . a perpendicular dropped from b , meets the side ac at d . a circle of radius bd ( with centre b ) is drawn . if the circle cuts ab and bc at p and q respectively , then ap : qc is equal to",d,geometry, 1 : 1', 3 : 2', 4 : 1', 3 : 8', 2 : 5'] 
583,the surface of a cube is 96 sq cm . find its volume ?,e,geometry, 8 cc', 9 cc', 2 cc', 4 cc', 64 cc'] 
584,"the largest four digit number which is a perfect cube , is :",c,geometry, 7000 , 8000 , 9261 , 9999 , none of these 
585,the angle between two hands at 3.45 is,e,geometry, 110 degree , 115 degree , 112 1 / 2 degree , 117 degree , 157 1 / 2 degree 
586,"a wooden cube whose edge length is 9 inches is composed of smaller cubes with edge lengths of one inch . the outside surface of the large cube is painted red and then it is split up into its smaller cubes . if one cube is randomly selected from the small cubes , what is the probability that the cube will have at least one red face ?",a,geometry, 52.9 % , 55.4 % , 58.3 % , 61.7 % , 64.5 % 
587,"rectangular tile each of size 80 cm by 40 cm must be laid horizontally on a rectangular floor of size 130 cm by 230 cm , such that the tiles do not overlap and they are placed with edges jutting against each other on all edges . a tile can be placed in any orientation so long as its edges are parallel to the edges of floor . no tile should overshoot any edge of the floor . the maximum number of tiles that can be accommodated on the floor is :",d,geometry, 6 , 2 , 8 , 9 , 7 
588,"the area of a square garden is q square feet and the perimeter is p feet . if q = 2 p + 48 , what is the perimeter of the garden in feet ?",d,geometry, 36 , 40 , 44 , 48 , 52 
589,"the roof of an apartment building is rectangular and its length is 4 times longer than its width . if the area of the roof is 784 feet squared , what is the difference between the length and the width of the roof ?",c,geometry, 38 . , 40 . , 42 . , 44 . , 46 . 
590,the perimeter of a square is 48 m . find the area of the square .,b,geometry, 161 m â ² .', 144 m â ² .', 166 m â ² .', 169 m â ² .', 273 m â ² .'] 
591,"rectangular tile each of size 25 cm by 16 cm must be laid horizontally on a rectangular floor of size 180 cm by 120 cm , such that the tiles do not overlap and they are placed with edges jutting against each other on all edges . a tile can be placed in any orientation so long as its edges are parallel to the edges of floor . no tile should overshoot any edge of the floor . the maximum number of tiles that can be accommodated on the floor is :",b,geometry, 52 , 54 , 55 , 65 , 48 
592,find the area of a rhombus one side of which measures 20 cm and one diagonal is 27 cm .,d,geometry, 600 cm 2 , 500 cm 2 , 400 cm 2 , 432 cm 2 , 100 cm 2 
593,"the length of a rectangular plot is thrice its breadth . if the area of the rectangular plot is 2028 sq m , then what is the breadth of the rectangular plot ?",c,geometry, 11 , 17 , 26 , 101 , 1322 
594,the area of an isosceles trapezoid with sides of length 5 and bases of length 7 and 13 is ?,a,geometry, 40', 41', 42', 43', 44'] 
595,"in a rectangular axis system , what is the area of a parallelogram with the coordinates : ( 4,4 ) , ( 7,4 ) , ( 5,9 ) , ( 8,9 ) ?",c,geometry, 21 .', 28 .', 5 .', 49 .', 52 .'] 
596,"a rectangular lawn of length 200 m by 120 m has two roads running along its center , one along the length and the other along the width . if the width of the roads is 5 m what is the area q covered by the two roads ?",c,geometry, 400 , 1550 , 1575 , 1600 , 1625 
597,find the surface area of a 8 cm x 6 cm x 2 cm brick .,e,geometry, 112 cu cm , 136 cu cm , 164 cu cm , 180 cu cm , 152 cu cm 
598,how many odd numbers between 10 and 800 are the squares of integers ?,a,geometry, 12 , 13 , 14 , 15 , 16 
599,"the dimensions of a rectangular solid are 4 inches , 6 inches , and 8 inches . if a cube , a side of which is equal to one of the dimensions of the rectangular solid , is placed entirely within thespherejust large enough to hold the cube , what the ratio of the volume of the cube to the volume within thespherethat is not occupied by the cube ?",e,geometry, 10 : 17 , 2 : 5 , 5 : 16 , 25 : 7 , 2 : 3 
600,"if y is the smallest positive integer such that 1,260 multiplied by y is the square of an integer , then y must be",d,geometry, 23 , 51 , 38 , 35 , 37 
601,how many books each of volume 250 meter cube can be packed into a crate of volume 4500 meter cube,b,geometry, 25 , can not be determined , 10 , 15 , 20 
602,a rectangular block 6 cm by 12 cm by 15 cm is cut into an exact number of equal cubes . find the least possible number of cubes ?,c,geometry, 20 , 25 , 40 , 50 , 35 
603,"in measuring the sides of a rectangle , one side is taken 12 % in excess and other 5 % in deficit . find the error percentage in the area calculated from these measurements .",b,geometry, 3.5 % , 6.4 % , 3 % , 5 % , 2.6 % 
604,"the percentage increase in the area of a rectangle , if each of its sides is increased by 20 %",c,geometry, 33 , 37 , 44 , 99 , 277 
605,"a rectangular lawn of dimensions 100 m * 60 m has two roads each 10 m wide running in the middle of the lawn , one parallel to the length and the other parallel to the breadth . what is the cost of traveling the two roads at rs . 3 per sq m ?",d,geometry, a ) 3820 , b ) 930 , c ) 9309 , d ) 4500 , e ) 8302 
606,"thin rectangular slab of potato was cut into two pieces for an osmosis lab . one piece is 50 mm greater than the other . if the original uncut slab is 600 mm , what is the length of the other piece of the potato after it is cut .",b,geometry, 550', 275', 50', 300', 250'] 
607,"in a rectangular coordinate system , what is the area of a rhombus whose vertices have the coordinates ( 0 , 3.5 ) , ( 12 , 0 ) , ( 0 , - 3.5 ) , ( - 12 , 0 ) ?",a,geometry, 84 , 88 , 112 , 116 , 120 
608,"the slant height of a cone is 14 cm and radius of the base is 12 cm , find the curved surface of the cone .",d,geometry, 150 , 170 , 48 , 528 , 600 
609,"triangle xyz is an isosceles right triangle . if side xy is longer than side yz , and the area of the triangle is 49 , what is the measure of side xy ?",c,geometry, 4', 4 √ 2', 14', 8 √ 2', can not be determined from the information provided'] 
610,what is the maximum number of pieces that a circular pizza can be cut into with 6 linear cuts ?,e,geometry, 12', 13', 16', 20', 22'] 
611,the area of a circular field is 13.86 hectares . find the cost of fencing it at the rate of rs . 4.50 per metre .,d,geometry, 2399 , 3888 , 2999 , 5940 , 2888 
612,"if the sides of a triangle are 26 cm , 25 cm and 10 cm , what is its area ?",e,geometry, 120 , 110 , 130 , 140 , 125 
613,"how much space , in cubic units , is left vacant when maximum number of 2 x 2 x 2 cubes are fitted in a rectangular box measuring 8 x 10 x 9 ?",e,geometry, 60 , 65 , 70 , 75 , 80 
614,find the area of the quadrilateral of one of its diagonals is 22 cm and its off sets 9 cm and 6 cm ?,b,geometry, 188 cm 2 , 165 cm 2 , 168 cm 2 , 198 cm 2 , 987 cm 2 
