,Problem,correct,category,option_a,option_b,option_c,option_d,option_e
226,"a classroom has 3 electric lamps . from a collocation of 10 electric bulbs of which 6 are good , 3 are selected at random and put in the lamps . find the probability that the room is lighted .",c,probability, 1 / 6 , 4 / 120 , 29 / 30 , 1 / 9 , none of these 
227,"in a bag containing 3 balls , a white ball was placed and then 1 ball was taken out at random . what is the probability that the extracted ball would turn on to be white , if all possible hypothesis concerning the color of theballs that initiallyin the bag were equally possible ?",b,probability, 2 / 3 , 5 / 8 , 5 / 9 , 3 / 7 , 4 / 7 
228,a number is selected at random from the first 30 natural numbers . what is the probability that the number is a multiple of either 3 or 17 ?,e,probability, 17 / 30 , 2 / 5 , 7 / 15 , 4 / 15 , 11 / 30 
229,three 6 faced dice are thrown together . the probability that all the three show the same number on them is -,b,probability, 1 / 39 , 1 / 36 , 1 / 32 , 1 / 31 , 1 / 30 
230,a bag contains 6 black and 3 white balls . one ball is drawn at random . what is the probability that the ball drawn is white ?,b,probability, 3 / 4 , 1 / 3 , 1 / 7 , 1 / 8 , 4 / 3 
231,rhoda tosses a coin 5 times . find the probability of getting exactly 4 heads .,a,probability, 5 / 32 , 6 / 32 , 5 / 16 , 4 / 32 , 8 / 32 
232,three 6 faced dice are thrown together . the probability that all the three show the same number on them is - .,a,probability, 1 / 36 , 1 / 216 , 1 / 48 , 1 / 55 , 1 / 90 
233,there are 23 students in a class . in how many different ways can a committee of 3 students be formed ?,c,probability, 1254 , 1482 , 1771 , 1875 , 1923 
234,"from a pack of cards , two cards are drawn one after the other , with replacement . what is the probability that the first card is a club and the second card is a king or queen ?",c,probability, 2 / 13 , 3 / 13 , 1 / 26 , 1 / 52 , 3 / 52 
235,a card is drawn from a pack of 52 cards . the probability of not getting a face card ?,a,probability, 9 / 13 , 5 / 12 , 3 / 13 , 6 / 17 , 1 / 13 
236,"potato chips are on sale , buy 2 get 1 free . there are only 9 bags of chips left ( 4 plain and 5 bbq ) . a shopper randomly grabs 3 bags . what is the probability the shopper will grab exactly 3 bags of bbq chips ?",d,probability, 2 / 3 , 1 / 3 , 1 / 5 , 5 / 42 , 7 / 42 
237,there are two bags a and b . a contains 6 red flowers and 3 pink flowers . where as bag b contains 2 red flowers and 7 pink flowers . one flower is chosen from a bag randomly . what is the probability that the flower chosen is pink ?,d,probability, 5 / 8 , 5 / 6 , 5 / 1 , 5 / 9 , 5 / 2 
238,a coin is tossed 8 times . what is the probability of getting exactly 7 heads ?,c,probability, 1 / 8 , 1 / 16 , 1 / 32 , 1 / 64 , 1 / 128 
239,"a meeting has to be conducted with 5 managers . find the number of ways in which the managers be selected from among 9 managers , if 2 managers will not attend the meeting together ?",b,probability, 35 , 91 , 120 , 126 , 150 
240,"a certain junior class has 1,000 students and a certain senior class has 800 students . among these students , there are 40 siblings pairs , each consisting of 1 junior and 1 senior . if 1 student is to be selected at random from each class , what is the probability that the 2 students selected at will be a sibling pair ?",c,probability, 3 / 40, 1 / 3, 1 / 20, 1 / 60 , 1 / 15 
241,a card is drawn from a pack of 52 cards . the probability of getting a queen club or a king of heart ?,b,probability, 3 / 26 , 1 / 26 , 4 / 26 , 6 / 26 , 10 / 26 
242,find the probability that a leap year chosen at random will have 53 sundays,a,probability, 2 / 7 , 2 / 6 , 2 / 5 , 2 / 3 , 2 / 4 
243,"there is a 20 % chance sandy will visit china this year , while there is a 70 % chance that she will visit malaysia this year . what is the probability that sandy will visit either china or malaysia this year , but not both ?",d,probability, 44 % , 48 % , 54 % , 62 % , 70 % 
244,in how many ways 3 boys and 3 girls can be seated in a row so that boys and girls are alternate ?,d,probability, 69 , 70 , 71 , 72 , 73 
245,"if x is to be chosen at random from the set { 1 , 2 , 3 } and y is to be chosen at random from the set { 5 , 6 , 7 } , what is the probability that xy will be even ?",e,probability, 1 / 6 , 1 / 3 , 1 / 2 , 2 / 3 , 5 / 6 
246,"if a card is drawn from a well shuffled deck of cards , what is the probability of drawing a black card or a face card ?",d,probability, 7 / 13 , 15 / 26 , 9 / 12 , 8 / 13 , 29 / 52 
247,"if you keep rolling a pair of dice together till a sum of 5 or 7 is obtained , then what is the probability that a sum of 5 comes before a sum of 7 ?",d,probability, 5 / 5 , 4 / 5 , 3 / 5 , 2 / 5 , 1 / 5 
248,a card is drawn from a pack of 52 cards . the probability of ge ƫ ng a queen of club or a king of heart is,c,probability, 1 / 13 , 2 / 13 , 1 / 26 , 1 / 52 , none of these 
249,"a jar contains only red , yellow , and orange marbles . if there are 3 red , 7 yellow , and 4 orange marbles , and 3 marbles are chosen from the jar at random without replacing any of them , what is the probability that 2 yellow , 1 red , and no orange marbles will be chosen ?",e,probability, 1 / 60 , 1 / 45 , 2 / 45 , 3 / 22 , 5 / 22 
250,the chance of rain on any given day in tel - aviv is 50 % . what is the probability q that it rained in tel - aviv on exactly 4 out of 6 randomly chosen days ?,a,probability, 15 / 64 , 30 / 64 , 1 / 2 , 1 / 4 , 52 / 64 
251,the chance of rain on any given day in tel - aviv is 50 % . what is the probability e that it rained in tel - aviv on exactly 4 out of 6 randomly chosen days ?,a,probability, 15 / 64 , 30 / 64 , 1 / 2 , 1 / 4 , 52 / 64 
252,there are 6 red shoes & 4 green shoes . if two of red shoes are drawn what is the probability of getting red shoes,a,probability, 1 / 3 , 1 / 4 , 1 / 2 , 1 / 5 , 1 / 6 
253,"what is the probability that carol and bernie will get selected for a job they both applied for in a company , given that their chances of getting selected is 4 / 5 and 3 / 5 respectively ?",d,probability, 8 / 25 , 11 / 24 , 12 / 25 , 12 / 25 , 12 / 23 
254,"if a card is drawn from a well shuffled pack of cards , the probability of drawing a spade or a king is ?",d,probability, 4 / 15 , 4 / 10 , 4 / 18 , 4 / 13 , 4 / 11 
255,what is the probability of randomly selecting one of the shortest diagonals from all the diagonals of a regular 9 - sided polygon ) ?,b,probability, 1 / 2 , 1 / 3 , 1 / 4 , 1 / 6 , 1 / 9 
256,seven 6 faced dice are thrown together . the probability that all the three show the same number on them is ?,b,probability, 1 / 32 , 1 / 46656 , 1 / 33 , 1 / 38 , 1 / 34 
257,what is the probability of getting exactly 1 head in a single throw of five fair coins ?,d,probability, 1 / 4 , 3 / 8 , 3 / 16 , 5 / 32 , 7 / 32 
258,how many cubes of 2 cm edge can be cut out of a cube of 24 cm edge,b,probability, 1136 , 1728 , 1216 , 1484 , none of these 
259,what is the probability of getting sum 10 with the help of three dice ?,b,probability, 1 / 4 , 1 / 8 , 1 / 16 , 1 / 24 , 1 / 32 
260,a bag contains 6 black and 9 white balls . one ball is drawn at random . what is the probability that the ball drawn is white ?,e,probability, 4 , 4 / 3 , 4 / 5 , 4 / 9 , 3 / 5 
261,"if x is to be chosen at random from the set { 1 , 2 , 3 , 4 } and y is to be chosen at random from the set { 5 , 6 , 7 , 8 } , what is the probability that xy will be even ?",c,probability, 1 / 6 , 1 / 3 , 1 / 2 , 2 / 3 , 5 / 6 
262,three unbiased coins are tossed . what is the probability of getting at least 2 tails ?,b,probability, 0.75 , 0.5 , 0.25 , 0.2 , 0.3 
263,"a bag contains 3 blue and 5 white marbles . one by one , marbles are drawn out randomly until only two are left in the bag . what is the probability z that out of the two , one is white and one is blue ?",d,probability, 15 / 56 , 41 / 56 , 13 / 28 , 15 / 28 , 5 / 14 
264,"from a pack of 52 cards , 1 card is drawn at random . find the probability of a face card drawn .",a,probability, 4 / 13 , 1 / 52 , 1 / 4 , 1 / 3 , none of these 
265,"when tossed , a certain coin has equal probability of landing on either side . if the coin is tossed 5 times , what is the probability that it will land on either side all 5 times ?",d,probability, 1 / 5 , 1 / 10 , 1 / 12 , 1 / 16 , 1 / 32 
266,there are 10 pairs of socks and 2 socks are worn from that such that the pair of socks worn are not of the same pair . what is the number of pair that can be formed .,a,probability, 90 , 85 , 75 , 95 , 82 
267,in how many ways can 21 books on english and 19 books on hindi be placed in a row on a shelf so that two books on hindi may not be together ?,a,probability, 1540 , 2314 , 5420 , 1240 , 4512 
268,three unbiased coins are tossed . what is the probability of getting 1 heads and 1 tail ?,b,probability, 3 / 4 , 1 / 4 , 3 / 8 , 7 / 8 , 1 / 8 
269,"a bag contains 5 white marbles and 5 black marbles . if each of 5 girls and 5 boys randomly selects and keeps a marble , what is the probability that all of the girls select the same colored marble ?",a,probability, 1 / 126 , 1 / 120 , 1 / 24 , 4 / 25 , 1 / 2 
270,what is the probability of randomly selecting one of the shortest diagonals from all the diagonals of a regular 7 - sided polygon ) ?,a,probability, 1 / 2 , 1 / 3 , 1 / 4 , 1 / 6 , 1 / 7 
271,what is the probability that a two digit number selected at random will be a multiple of ' 3 ' and not a multiple of ' 5 ' ?,b,probability, 2 / 15 , 4 / 15 , 1 / 15 , 4 / 90 , 5 / 60 
272,what is the probability of randomly selecting one of the shortest diagonals from all the diagonals of a regular 11 - sided polygon ) ?,c,probability, 1 / 2 , 1 / 3 , 1 / 4 , 1 / 8 , 1 / 11 
273,in a throw of a coin probability of getting a head .,e,probability, 1 / 3 , 2 / 3 , 1 / 4 , 2 / 5 , 1 / 2 
274,"how many positive integers less than 500 can be formed using the numbers 1 , 2,3 , and 5 for digits , each digit being used only once .",a,probability, 34 , 677 , 197 , 177 , 191 
275,find the probability that a leap year selected at random will have 53 sundays,e,probability, 6 / 7 , 5 / 7 , 4 / 7 , 3 / 7 , 2 / 7 
276,"a bag contains 15 red jellybeans and 15 blue jellybeans . if 3 jellybeans are removed one at a time , at random and are not replaced , what is the probability that all 3 jellybeans removed from the bag are blue ?",e,probability, 9 / 100 , 2 / 19 , 1 / 8 , 3 / 20 , 3 / 10 
277,how many cubes of 5 cm edge can be cut out of a cube of 15 cm edge,c,probability, 36 , 232 , 27 , 48 , none of these 
278,what is the probability that company g ' s advertisement will be one of the first two be shown during the first commercial break ?,d,probability, 1 / 225 , 1 / 30 , 1 / 15 , 2 / 15 , 4 / 15 
279,"the maitre ' d at an expensive manhattan restaurant has noticed that 60 % of the couples order dessert and coffee . however , 20 % of the couples who order dessert do n ' t order coffee . what is the probability y that the next couple the maitre ' d seats will not order dessert ?",b,probability, 20 % , 25 % , 40 % , 60 % , 75 % 
280,"what is the probability that the sum of two dice will yield a 7 , and then when both are thrown again , their sum will again yield a 7 ? assume that each die has 6 sides with faces numbered 1 to 6 .",b,probability, 1 / 144 , 1 / 36 , 1 / 12 , 1 / 6 , 1 / 3 
281,5 letters have to be put in 5 different envelopes numbered 1 through 5 such that each of the letters go into only 1 envelope . the letter is said to be put in correct position if for example letter 1 goes into envelope 1 . now what is the probability that all letters be put into wrong envelopes ?,d,probability, 1 / 3 , 2 / 3 , 11 / 120 , 11 / 30 , 76 / 120 
282,in how many ways 4 boys and 4 girls can be seated in a row so that boys and girls are alternate ?,a,probability, 1152 , 1987 , 2012 , 1856 , 2546 
283,"a basket contains 6 apples , of which 1 is spoiled and the rest are good . if we select 2 apples from the basket simultaneously and at random , what is the probability that the 2 apples selected will include the spoiled apple ?",a,probability, 1 / 2 , 1 / 3 , 1 / 4 , 1 / 5 , 1 / 6 
284,three unbiased coins are tossed . what is the probability of getting 2 heads and 2 tail ?,a,probability, 5 / 8 , 1 / 4 , 3 / 8 , 7 / 8 , 1 / 8 
285,"in a garden , there are yellow and green flowers which are straight and curved . if the probability of picking a green flower is 2 / 3 and picking a straight flower is 1 / 2 , then what is the probability of picking a flower which is yellow and straight",a,probability, 1 / 6 , 1 / 8 , 1 / 4 , 3 / 4 , 7 / 8 
286,in a throw of a coin find the probability of getting a head ?,a,probability, 1 / 2 , 1 / 3 , 1 / 4 , 2 / 3 , 2 / 5 
287,"the maitre ' d at an expensive manhattan restaurant has noticed that 60 % of the couples order dessert and coffee . however , 20 % of the couples who order dessert do n ' t order coffee . what is the probability r that the next couple the maitre ' d seats will not order dessert ?",b,probability, 20 % , 25 % , 40 % , 60 % , 75 % 
288,"if a coin is flipped , the probability that the coin will land tails is 1 / 2 . if the coin is flipped 4 times , what is the probability that it will land tails up on the first 2 flips and not on the last 2 flips ?",d,probability, 1 / 4 , 1 / 8 , 1 / 2 , 1 / 16 , 1 / 32 
289,three unbiased coins are tossed . what is the probability of getting 3 heads ?,e,probability, 3 / 4 , 1 / 4 , 3 / 8 , 7 / 8 , 1 / 8 
290,"kim has 6 pairs of shoes ; each pair is a different color . if kim randomly selects 2 shoes without replacement from the 12 shoes , what is the probability that she will select 2 shoes of the same color ?",d,probability, 2 / 5 , 1 / 5 , 1 / 9 , 1 / 11 , 1 / 25 
291,in a throw of dice what is the probability of ge æ « ing number greater than 2,a,probability, 2 / 3 , 1 / 3 , 1 / 5 , 1 / 6 , none of these 
292,"the membership of a committee consists of 4 english teachers , 2 mathematics teachers , and 2 social studies teachers . if 2 committee members are to be selected at random to write the committee ’ s report , what is the probability that the two members selected will both be english teachers ?",e,probability, 2 / 3 , 1 / 3 , 2 / 9 , 1 / 12 , 3 / 28 
293,"kim has 4 pairs of shoes ; each pair is a different color . if kim randomly selects 2 shoes without replacement from the 8 shoes , what is the probability that she will select 2 shoes of the same color ?",a,probability, 1 / 7 , 1 / 8 , 1 / 9 , 1 / 10 , 1 / 25 
294,"two cards are drawn together from a pack of 52 cards . the probability that one is a spade and one is a heart , is :",e,probability, 2 / 109 , 7 / 109 , 8 / 223 , 14 / 263 , 13 / 102 
295,"there are 11 boys and 10 girls in a class . if three students are selected at random , in how many ways that 3 girl & 2 boys are selected ?",a,probability, 6600 , 1300 , 6780 , 1976 , 2448 
296,"on a ranch , a rancher can place a loop of rope , called a lasso , once in every 2 throws around a cow ’ s neck . what is the probability that the rancher will be able to place a lasso around a cow ’ s neck at least once in 6 attempts ?",e,probability, 3 / 4 , 7 / 8 , 15 / 16 , 31 / 32 , 63 / 64 
297,"there are 13 boys and 10 girls in a class . if three students are selected at random , in how many ways that 1 girl & 2 boys are selected ?",c,probability, 120 , 480 , 780 , 720 , 800 
298,"how many different pairs of numbers ( s , t ) such that s = 3 t can be obtained if s and t are selected from the set of number { 0 , 1 , 2 , 3 , 4 , 5 , 6 , 7 , 8 , 9 , 10 , 11 , 12 }",e,probability, 1 , 2 , 3 , 4 , 5 
299,three unbiased coins are tossed . what is the probability of getting at most 2 heads ?,a,probability, 7 / 8 , 5 / 8 , 3 / 8 , 7 / 5 , 3 / 5 
300,"a bag consists of 20 marbles , of which 6 are blue , 9 are red , and the remainder are white . if lisa is to select a marble from the bag at random , what is the probability that the marble will be red or white ?",a,probability, 7 / 10 , 2 / 4 , 1 / 4 , 1 / 8 , 1 / 16 
301,"a jar contains only red , yellow , and orange marbles . if there are 1 red , 5 yellow , and 4 orange marbles , and 3 marbles are chosen from the jar at random without replacing any of them , what is the probability that 2 yellow , 1 red , and no orange marbles will be chosen ?",b,probability, 1 / 60 , 1 / 45 , 2 / 45 , 3 / 22 , 5 / 22 
302,a father purchased dress for his 3 daughters . the dresses are of same color but diff size and they are kept in dark room . what is probability that all the 3 will not choose there own dress ?,a,probability, 1 / 3 , 2 / 3 , 1 / 2 , 3 / 4 , 3 / 7 
303,there are 20 students in a class . in how many different ways can a committee of 3 students be formed ?,d,probability, 650 , 730 , 980 , 1140 , 1480 
304,"from a pack of 52 cards , 1 card is drawn at random . find the probability of a face card drawn",a,probability, 4 / 13 , 1 / 52 , 1 / 4 , 1 / 5 , none of above 
305,"a question paper has 2 parts , a & b , each containing 6 questions . if a student has to choose 4 from part a & 3 from part b , in how many ways can he choose the questions ?",d,probability, 100 , 200 , 350 , 150 , 140 
306,"three unbiased coins are tossed , what is the probability of getting at least 2 tails ?",d,probability, 1 / 5 , 1 / 7 , 1 / 8 , 1 / 2 , 1 / 10 
307,"a child want to buy 5 new toys . if there are 15 toys that satisfy the child ' s criteria , in how many different ways can the child select the 5 new toys if the order of selection does n ' t matter .",c,probability, 210 , 1365 , 3003 , 5005 , 3030 
308,a bag contains 6 black and 6 white balls . one ball is drawn at random . what is the probability that the ball drawn is white ?,b,probability, 3 / 4 , 1 / 2 , 1 / 7 , 1 / 8 , 4 / 3 
309,there is a 75 % chance that tigers will not win at all during the whole season . there is a 25 % chance that germany will not play at all in the whole season . what is the greatest possible probability that the tigers will win and germany will play during the season ?,d,probability, 55 % , 60 % , 70 % , 75 % , 80 % 
310,"how many positive integers less than 600 can be formed using the numbers 1 , 2 , 3 and 5 for the digits ?",e,probability, 48 , 52 , 66 , 68 , 84 
311,what is the probability of having 53 fridays in an ordinary year,c,probability, 1 / 5 , 1 / 6 , 1 / 7 , 1 / 8 , 1 / 9 
312,"a bag contains 3 red , 5 yellow and 4 green balls . 3 balls are drawn randomly . what is the probability that balls drawn contain exactly two green balls ?",c,probability, 9 / 16 , 7 / 18 , 12 / 55 , 14 / 67 , 19 / 87 
313,"the letters o , l and t are rearranged to form the word ' lot ' . find its probability .",e,probability, 1 / 18 , 1 / 12 , 1 / 4 , 1 / 8 , 1 / 6 
314,"in a certain animal population , for each of the first 3 months of life , the probability that an animal will die during that month is 1 / 10 . for a group of 200 newborn members of the population , approximately how many would be expected to survive the first 3 months of life ?",b,probability, 140 , 146 , 152 , 162 , 170 
315,what is the probability of getting a sum 9 from two throws of a dice ?,c,probability, 1 / 6 , 1 / 8 , 1 / 9 , 1 / 12 , none of these 
316,"a jar contains only red , yellow , and orange marbles . if there are 3 red , 5 yellow , and 4 orange marbles , and 2 marbles are chosen from the jar at random without replacing any of them , what is the probability that 2 yellow , 1 red , and no orange marbles will be chosen ?",e,probability, 1 / 60 , 1 / 45 , 2 / 45 , 3 / 22 , 6 / 22 
317,"a jar contains 5 black and 2 white balls . if you pick two balls at the same time , what ' s the probability that one ball is black and one is white ?",b,probability, 2 / 7 , 5 / 21 , 4 / 21 , 3 / 7 , 1 / 2 
318,"if a coin is flipped , the probability that the coin will land heads is 1 / 2 . if the coin is flipped 6 times , what is the probability that it will land heads up on all 6 flips ?",e,probability, 1 / 6 , 1 / 8 , 1 / 32 , 1 / 2 , 1 / 64 
319,a jar contains 18 balls . 3 blue balls are removed from the jar and not replaced . now the probability of getting a blue ball is 1 / 5 then how many blue balls jar contains initially ?,e,probability, 2 , 3 , 4 , 5 , 6 
320,"there are 20 balls in a jar . you take out 2 blue balls without putting them back inside , and now the probability of pulling out a blue ball is 1 / 5 . how many blue balls were there in the beginning ?",a,probability, 12 . , 9 . , 8 . , 7 . , 6 . 
321,there are 10 students named alphabetically from a to j . what is the probability that a and d do not sit together if all 10 sit around a circular table ?,c,probability, 2 / 9 , 2 / 5 , 7 / 9 , 4 / 5 , 8 / 9 
322,"if 4 people are selected from a group of 7 married couples , what is the probability that none of them would be married to each other ?",e,probability, 1 / 33 , 2 / 33 , 1 / 3 , 16 / 33 , 47 / 84 
323,a fair coin is tossed 5 times . what is the probability of getting more heads than tails in 5 tosses ?,a,probability, 1 / 2 , 63 / 128 , 4 / 7 , 61 / 256 , 63 / 64 
324,"in a bag containing 5 balls , a white ball was placed and then 1 ball was taken out at random . what is the probability that the extracted ball would turn on to be white , if all possible hypothesis concerning the color of the balls that initiallyin the bag wereequally possible ?",b,probability, 2 / 3 , 5 / 8 , 5 / 4 , 5 / 6 , 6 / 7 
325,"in a single throw of a die , what is the probability of getting a number greater than 4 ?",a,probability, 1 / 3 , 1 / 4 , 2 / 3 , 2 / 5 , 3 / 7 
326,"if a certain coin is flipped , the probability that the coin will land heads is 1 / 2 . if the coin is flipped 5 times , what is the probability that it will land heads up on the first flip but not on the last 4 flips ?",d,probability, 1 / 4 , 1 / 8 , 1 / 16 , 1 / 32 , 1 / 64 
327,"wink , inc . follows a certain procedure that requires two tasks to be finished independently in order for a job to be done . on any given day , there is a 5 / 8 probability that task 1 will be completed on time , and a 3 / 5 probability that task 2 will be completed on time . on a certain day , what is the probability that task 1 will be completed on time , but task 2 will not ?",a,probability, 1 / 4 , 3 / 40 , 13 / 40 , 7 / 20 , 13 / 22 
328,a coin is tossed six times . what is the probability that there is at the least one tail ?,a,probability, 63 / 64 , 31 / 37 , 31 / 18 , 31 / 10 , 31 / 19 
329,"how many positive integers less than 500 can be formed using the numbers 1 , 2 , 3 and 5 for the digits ?",d,probability, 48 , 52 , 66 , 68 , 84 
330,"if a coin is flipped , the probability that the coin will land tails is 1 / 2 . if the coin is flipped 5 times , what is the probability that it will land tails up on the first 2 flips and not on the last 3 flips ?",b,probability, 3 / 5 , 1 / 32 , 1 / 5 , 1 / 4 , 1 / 2 
331,"a jar contains 4 black and 3 white balls . if you pick two balls at the same time , what ' s the probability that one ball is black and one is white ?",c,probability, 2 / 7 , 5 / 7 , 4 / 7 , 3 / 7 , 1 / 2 
332,"out of 15 students in a class , 7 are from maharashtra , 5 are from karnataka , and 3 are from goa . four students are to be selected at random . what are the chances that at least one is from karnataka ?",b,probability, 12 / 13 , 11 / 13 , 10 / 15 , 1 / 15 , 4 / 14 
333,"a child want to buy 3 new toys . if there are 10 toys that satisfy the child ' s criteria , in how many different ways can the child select the 3 new toys if the order of selection does n ' t matter .",b,probability, 20 , 120 , 210 , 15 , 45 
334,"a certain junior class has 1,200 students and a certain senior class has 800 students . among these students , there are 60 siblings pairs , each consisting of 1 junior and 1 senior . if 1 student is to be selected at random from each class , what is the probability that the 2 students selected at will be a sibling pair ?",e,probability, 3 / 40, 1 / 3, 9 / 2, 1 / 60 , 1 / 16
335,"out of 10 students in a class , 4 are from maharashtra , 3 are from karnataka , and 3 are from goa . four students are to be selected at random . what are the chances that at least one is from karnataka ?",c,probability, 1 / 3 , 4 / 9 , 5 / 6 , 3 / 7 , 1 / 4 
336,"there are 15 boys and 10 girls in a class . if three students are selected at random , in how many ways that 1 girl and 2 boys are selected ?",b,probability, 950 , 1050 , 2150 , 2050 , 1000 
337,in how many ways 6 boys and 4 girls can be seated in a row so that they are alternative ?,c,probability, 14420 , 12620 , 17280 , 21200 , 24560 
338,in how many ways can 22 books on english and 20 books on hindi be placed in a row on a shelf so that two books on hindi may not be together ?,d,probability, 4586 , 5896 , 2415 , 1771 , 1881 
339,"a box contains 100 balls , numbered from 1 to 100 . if 3 balls are selected at random and with replacement from the box . if the 3 numbers on the balls selected contain two odd and one even . what is the probability j that the first ball picked up is odd numbered ?",d,probability, 0 , 1 / 3 , 1 / 2 , 2 / 3 , 1 
340,"a bag contains 3 white marbles and 3 black marbles . if each of 3 girls and 3 boys randomly selects and keeps a marble , what is the probability that all of the girls select the same colored marble ?",b,probability, 1 / 35 , 1 / 10 , 1 / 15 , 1 / 20 , 1 / 25 
341,"in a certain animal population , for each of the first 3 months of life , the probability that an animal will die during that month is 1 / 10 . for a group of 600 newborn members of the population , approximately how many would be expected to survive the first 3 months of life ?",a,probability, 438 , 446 , 452 , 462 , 470 
342,five 6 faced dice are thrown together . the probability that all the three show the same number on them is ?,b,probability, 1 / 32 , 1 / 1296 , 1 / 33 , 1 / 38 , 1 / 34 
